Наименование остановки;Официальное наименование;Расположение;Широта;Долгота;Тип объекта;Маршруты
"СРЕДНИЙ ПР. В.О. [1, 24]";"СРЕДНИЙ ПР. В.О.";"Гаванская ул., Средний пр.";"59,93212852";"30,2398472";"Остановка";"1,7,7А"
""СТ. МЕТРО "АВТОВО"";""СТ. МЕТРО "АВТОВО"";"Стачек пр., Кронштадтская ул.";"59,86828608";"30,260006";"Остановка";"1М,1МБ,2А,17,18,20,26,73,83,108,145,145А,160,200,210,229,300,481,482,482А,482В,484,484Б,487"
""СТ. МЕТРО "АКАДЕМИЧЕСКАЯ" [40, 93, 178]"";""СТ. МЕТРО "АКАДЕМИЧЕСКАЯ"";"Науки пр., Гражданский пр.";"60,01336189";"30,3971214";"Остановка";"1М,1МА,40,93,176"
""СТ. МЕТРО "АКАДЕМИЧЕСКАЯ" [153, 102, 103]"";""СТ. МЕТРО "АКАДЕМИЧЕСКАЯ"";"Гражданский пр., Науки пр.";"60,01344382";"30,3983555";"Остановка";"1М,1МА,60,93,102,103,153,177,178"
""СТ. МЕТРО "ВАСИЛЕОСТРОВСКАЯ" [6, 1]"";""СТ. МЕТРО "ВАСИЛЕОСТРОВСКАЯ"";"Средний пр., 4-5-я линии";"59,94376503";"30,2804928";"Остановка";"1,3М,3МА,6,47,100,128"
""СТ. МЕТРО "ВОЛКОВСКАЯ"";""СТ. МЕТРО "ВОЛКОВСКАЯ"";"Касимовская ул., Бухарестская ул.";"59,89626607";"30,3577538";"Остановка";"57,74,91,117"
""СТ. МЕТРО "ГОРЬКОВСКАЯ" "";""СТ. МЕТРО "ГОРЬКОВСКАЯ"";"Каменноостровский пр., Кронверкский пр.";"59,95581809";"30,3208904";"Остановка";"2М,46,46А"
""СТ. МЕТРО "ГОСТИНЫЙ ДВОР" [3, 7, 22, 24, 27]"";""СТ. МЕТРО "ГОСТИНЫЙ ДВОР"";"Невский пр., Перинная линия";"59,93439387";"30,332737";"Остановка";"3,3М,3МБ,4М,4МБ,5М,5МБ,7,7А,22,24,24А,27,135,135А,191,191А"
""СТ. МЕТРО "ГРАЖДАНСКИЙ ПР." [93]"";""СТ. МЕТРО "ГРАЖДАНСКИЙ ПР."";"Просвещения пр., Гражданский пр.";"60,03575852";"30,4195004";"Остановка";"1М,1МА,60,121,139,176"
""СТ. МЕТРО "ЕЛИЗАРОВСКАЯ"";""СТ. МЕТРО "ЕЛИЗАРОВСКАЯ"";"Бабушкина ул., Елизарова пр.";"59,89677651";"30,4229851";"Остановка";"3М,3МБ,31,114,116"
""СТ. МЕТРО "ЗВЕЗДНАЯ" [34, 50, 116]"";""СТ. МЕТРО "ЗВЕЗДНАЯ"";"Звёздная ул., Пулковская ул.";"59,83368296";"30,3517361";"Остановка";"16,34,59,64,64А,116,179,186,190,192"
""СТ. МЕТРО "КИРОВСКИЙ ЗАВОД" [2, 66]"";""СТ. МЕТРО "КИРОВСКИЙ ЗАВОД"";"Стачек пр., Васи Алексеева ул.";"59,87967079";"30,2606678";"Остановка";"1М,1МБ,2,66"
""СТ. МЕТРО "КОМЕНДАНТСКИЙ ПРОСПЕКТ" [134]"";""СТ. МЕТРО "КОМЕНДАНТСКИЙ ПРОСПЕКТ"";"Ильюшина ул., Гаккелевская ул.";"60,00760587";"30,2563858";"Остановка";"126,134Б,172"
""СТ. МЕТРО "КОМЕНДАНТСКИЙ ПРОСПЕКТ" "";""СТ. МЕТРО "КОМЕНДАНТСКИЙ ПРОСПЕКТ"";"Комендантский пр., Уточкина ул.";"60,00875647";"30,2586231";"Остановка";"127"
""СТ. МЕТРО "КУПЧИНО"";""СТ. МЕТРО "КУПЧИНО"";"Ярослава Гашека ул., Малая Балканская ул.";"59,82926536";"30,3803368";"Остановка";"2М,2МА,50,54,56,74,96,157,159"
""СТ. МЕТРО "ЛАДОЖСКАЯ"";""СТ. МЕТРО "ЛАДОЖСКАЯ"";"Заневский пр., Энергетиков пр.";"59,93326463";"30,4342709";"Остановка";"4М,4МА,24,24А,27"
""СТ. МЕТРО "ЛЕСНАЯ" [33, 137]"";""СТ. МЕТРО "ЛЕСНАЯ"";"ул. Кантемировская, ул. Парголовская";"59,98551474";"30,3453312";"Остановка";"33,60,137,185"
""СТ. МЕТРО "ЛИГОВСКИЙ ПР." [15, 65, 74, 3]"";""СТ. МЕТРО "ЛИГОВСКИЙ ПР."";"Лиговский пр., Остропольский пер.";"59,92051872";"30,3540478";"Остановка";"3,26,54,65,74,76,91,141"
""СТ. МЕТРО "ЛОМОНОСОВСКАЯ"";""СТ. МЕТРО "ЛОМОНОСОВСКАЯ"";"Бабушкина ул., Матюшенко пер.";"59,87738799";"30,4429321";"Остановка";"3М,3МБ,5,95,97,118"
""СТ. МЕТРО "МОСКОВСКАЯ" [114]"";""СТ. МЕТРО "МОСКОВСКАЯ"";"улица Типанова, Московский проспект";"59,85085351";"30,3227692";"Остановка";"31,114"
""СТ. МЕТРО "МОСКОВСКАЯ" [3, 11, 13, 13А, 31, Э, 39, 90, 187, 39]"";""СТ. МЕТРО "МОСКОВСКАЯ"";"Московский пр., Алтайская ул.";"59,84982092";"30,3218708";"Остановка";"3,11,13,13А,39,59,90,141,150,155,156,187"
""СТ. МЕТРО "НЕВСКИЙ ПР." [3, 7, 22, 27, 24]"";""СТ. МЕТРО "НЕВСКИЙ ПР."";"Невский пр., Думская ул.";"59,93508166";"30,3291683";"Остановка";"3,3М,3МБ,7,7А,22,24,24А,27,135,135А,191,191А"
""СТ. МЕТРО "НОВОЧЕРКАССКАЯ" "";""СТ. МЕТРО "НОВОЧЕРКАССКАЯ"";"Заневский пр., Новочеркасский пр.";"59,92916484";"30,4136162";"Остановка";"4М,4МА,24,24А,27,174"
""СТ. МЕТРО "ОЗЕРКИ"";""СТ. МЕТРО "ОЗЕРКИ"";"проспект Энгельса, Выборгское шоссе";"60,03627705";"30,3229809";"Остановка";"2М,2МБ,80,123"
""СТ. МЕТРО "ПАРК ПОБЕДЫ" [50, 3, Э, 39, 72]"";""СТ. МЕТРО "ПАРК ПОБЕДЫ"";"Московский пр., Бассейная ул.";"59,86650997";"30,3210373";"Остановка";"2М,2МА,3,26,50"
""СТ. МЕТРО "ПЕТРОГРАДСКАЯ" [1, 46А]"";""СТ. МЕТРО "ПЕТРОГРАДСКАЯ"";"Каменноостровский пр., Льва Толстого пл.";"59,96656432";"30,310936";"Остановка";"1,2М,2МБ,46,46А"
""СТ. МЕТРО "ПИОНЕРСКАЯ"";""СТ. МЕТРО "ПИОНЕРСКАЯ"";"Испытателей пр., Коломяжский пр.";"60,00254889";"30,2996483";"Остановка";"2М,2МБ,9,93"
""СТ. МЕТРО "ПЛОЩАДЬ АЛ. НЕВСКОГО" [58, 8, 27, 24, 132]"";""СТ. МЕТРО "ПЛОЩАДЬ АЛ. НЕВСКОГО"";"Невский пр., Чернорецкий пер.";"59,92396238";"30,38381";"Остановка";"3М,3МБ,4М,4МБ,8,24,24А,27,46,55,58,132,191,191А"
"КОМЕНДАНТСКИЙ ПР.,50 [127, 85]";"КОМЕНДАНТСКИЙ ПР.,50";"Комендантский пр., Шуваловский пр.";"60,02703782";"30,2364616";"Остановка";"79,85,127,170"
"КОМСОМОЛЬСКАЯ ПЛОЩАДЬ";"КОМСОМОЛЬСКАЯ ПЛОЩАДЬ";"Стачек пр., Краснопутиловская ул.";"59,8749782";"30,2580929";"Остановка";"1М,1МБ,2,17,20,83,108,111,111,145,145А,160,200,210,229,300,481,487"
"КОМСОМОЛЬСКАЯ ПЛОЩАДЬ";"КОМСОМОЛЬСКАЯ ПЛОЩАДЬ";"Комсомольская пл., Стачек пр.";"59,87697666";"30,257206";"Остановка";"2А,66,111"
"КОННОГВАРДЕЙСКИЙ ПЕР. [70]";"КОННОГВАРДЕЙСКИЙ ПЕР.";"Конногвардейский бул., Якубовича ул.";"59,93300114";"30,2986794";"Остановка";"3М,7А,10А,24А,70,135А,191А"
"КОНСТАНТИНОВСКИЙ ДВОРЕЦ [200, 210, 359]";"КОНСТАНТИНОВСКИЙ ДВОРЕЦ";"Санкт-Петербургское ш.";"59,85162879";"30,0621414";"Остановка";"162,163,200,210,359"
"КОНТОРСКАЯ УЛ. [15, 22, 136, 174]";"КОНТОРСКАЯ УЛ.";"Среднеохтинский пр., Конторская ул.";"59,9453044";"30,4134865";"Остановка";"15,22,136,174"
"КОНЮШЕННАЯ УЛ.";"КОНЮШЕННАЯ УЛ.";"Октябрьский бульвар, ул. Оранжерейная";"59,72252295";"30,4140091";"Остановка";"187,188"
"КОСАЯ ЛИНИЯ [1, 7]";"КОСАЯ ЛИНИЯ";"Большой пр. В.О., 24-25-я линии";"59,93255627";"30,2609348";"Остановка";"1,7,7А,128"
"КРАСНАЯ МЫЗА [487, 487, 487а]";"КРАСНАЯ МЫЗА";"Таллинское ш.";"59,59798797";"29,4474316";"Остановка";"487"
"КРАСНАЯ УЛ.";"КРАСНАЯ УЛ.";"ул. Ремезова, Красная ул.";"59,74086596";"30,604641";"Остановка";"326,369,386"
"КРАСНОГВАРДЕЙСКАЯ ПЛ.";"КРАСНОГВАРДЕЙСКАЯ ПЛ.";"Якорная ул., Шаумяна пр.";"59,94249928";"30,4141693";"Остановка";"132"
"КРАСНОГРАДСКИЙ ПЕР. [70]";"КРАСНОГРАДСКИЙ ПЕР.";"Красноградский переулок, Вознесенский пр.";"59,92533153";"30,3078899";"Остановка";"10,10А,70"
"КРАСНОПУТИЛОВСКАЯ УЛ. [13, 13А, 31, 187]";"КРАСНОПУТИЛОВСКАЯ УЛ.";"Варшавская ул., Краснопутиловская ул.";"59,84872998";"30,3150501";"Остановка";"13,13А,31,150,155,187"
"КРАСНОПУТИЛОВСКАЯ УЛ., 95";"КРАСНОПУТИЛОВСКАЯ УЛ., 95";"Краснопутиловская ул., Конституции пл.";"59,85330278";"30,3024864";"Остановка";"62,72"
"КРАСНОПУТИЛОВСКАЯ УЛ. 67 [72]";"КРАСНОПУТИЛОВСКАЯ УЛ. 67";"Краснопутиловская ул., ЗСД";"59,86102333";"30,2875996";"Остановка";"72"
"КРАСНОПУТИЛОВСКАЯ УЛ. 85 [72]";"КРАСНОПУТИЛОВСКАЯ УЛ. 85";"Краснопутиловская ул.";"59,85526825";"30,2988224";"Остановка";"62,72"
"КРАСНОСЕЛЬСКОЕ ШОССЕ,32 [488]";"КРАСНОСЕЛЬСКОЕ ШОССЕ,32";"Красносельское ш.";"59,82223443";"30,0734768";"Остановка";"129,461,462,488"
"КРАСНОСЕЛЬСКОЕ ШОССЕ,40 [20, 145, 165, 482, 482а, 482в, 484, 484б]";"КРАСНОСЕЛЬСКОЕ ШОССЕ,40";"Таллинское ш.";"59,78863856";"30,1432056";"Остановка";"20,81,145,145А,165,481,482,482А,482В,484,484Б,487"
"КРАСНОСЕЛЬСКОЕ ШОССЕ,54 [488]";"КРАСНОСЕЛЬСКОЕ ШОССЕ,54";"Красносельское ш.";"59,8179149";"30,074501";"Остановка";"461,488"
"КРАСНОФЛОТСКИЙ ПЕР. [210, 359, 200]";"КРАСНОФЛОТСКИЙ ПЕР.";"Санкт-Петербургское ш.";"59,85193066";"30,0798664";"Остановка";"163,200,210,359"
"КРОНШТАДСКАЯ УЛ. [2]";"КРОНШТАДСКАЯ УЛ.";"Зенитчиков ул., Кронштадтская ул.";"59,87277735";"30,2563725";"Остановка";"2,111"
"КРОНШТАДТСКАЯ ПЛОЩАДЬ [20, 200, 210]";"КРОНШТАДТСКАЯ ПЛОЩАДЬ";"проспект Стачек, Кронштадтская площадь";"59,85096329";"30,2345905";"Остановка";"20,108,200,210,481"
"КРОНШТАДТСКАЯ ПЛОЩАДЬ [142]";"КРОНШТАДТСКАЯ ПЛОЩАДЬ";"Ленинский пр., Стачек пр.";"59,85200613";"30,2406731";"Остановка";"26,142"
"КУЗНЕЦОВСКАЯ УЛ. [3, 50]";"КУЗНЕЦОВСКАЯ УЛ.";"Московский пр., Кузнецовская ул.";"59,87243796";"30,32061";"Остановка";"2М,2МА,3,26,50"
"КУЗНЕЧНЫЙ ПЕРЕУЛОК";"КУЗНЕЧНЫЙ ПЕРЕУЛОК";"Лиговский пр., Кузнечный пер.";"59,92607427";"30,3580055";"Остановка";"3,4М,4МБ,26,54,65,74,76,91,141"
"КУЗЬМИНСКОЕ ШОССЕ [187]";"КУЗЬМИНСКОЕ ШОССЕ";"Кузьминское ш., Ленинградская ул.";"59,73341016";"30,3940582";"Остановка";"187,371"
"КУПЧИНСКАЯ УЛ. [56]";"КУПЧИНСКАЯ УЛ.";"ул. Олеко Дундича, ул. Купчинская";"59,82780299";"30,39855";"Остановка";"56"
""КИНОЦЕНТР "ЧАЙКА"";""КИНОЦЕНТР "ЧАЙКА"";"Димитрова ул., Купчинская ул.";"59,8464725";"30,3803673";"Остановка";"74,157"
"КУПЧИНСКАЯ УЛ. (ПО УЛ. О. ДУНДИЧА)";"КУПЧИНСКАЯ УЛ. (ПО УЛ. О. ДУНДИЧА)";"ул. Олеко Дундича, ул. Купчинская";"59,82792314";"30,3963699";"Остановка";"2М,2МА,50,54,56,74,157,159"
"КУПЧИНСКАЯ УЛ. (ПО УЛ. Я. ГАШЕКА) [56]";"КУПЧИНСКАЯ УЛ. (ПО УЛ. Я. ГАШЕКА)";"ул. Ярослава Гашека, ул. Купчинская";"59,83306171";"30,3913612";"Остановка";"2М,2МА,50,53,54,56,96,159,326"
"КУПЧИНСКАЯ УЛ. УГ. УЛ. Я. ГАШЕКА";"КУПЧИНСКАЯ УЛ. УГ. УЛ. Я. ГАШЕКА";"ул. Купчинская, ул. Ярослава Гашека";"59,83454444";"30,3913918";"Остановка";"2М,2МА,50,326"
"КУРЛЯНДСКАЯ УЛ. [2, 6, 49, 66]";"КУРЛЯНДСКАЯ УЛ.";"Старо-Петергофский пр., Курляндская ул.";"59,9121888";"30,2771606";"Остановка";"2,6,49,66"
"КУРСКАЯ УЛ. [3]";"КУРСКАЯ УЛ.";"Лиговский пр., Курская ул.";"59,91152108";"30,348341";"Остановка";"3,26,54,91,141"
"КУРСКАЯ УЛ. 28";"КУРСКАЯ УЛ. 28";"ул. Курская, ул. Днепропетровская";"59,91089101";"30,3556213";"Остановка";"5М,5МБ,74,76"
"ЛАГОЛОВО [482, 482а, 482в, 484, 484б, 487]";"ЛАГОЛОВО";"Нарвское ш.";"59,70930686";"30,0123272";"Остановка";"481,482,482А,482В,484,484Б,487,547"
"ЛАШКОВИЦЫ [487, 487, 487а]";"ЛАШКОВИЦЫ";"Таллинское ш.";"59,58810434";"29,3819542";"Остановка";"487"
"ЛЕНИНГРАДСКАЯ УЛ. УГОЛ ШКОЛЬНОЙ УЛ. [186]";"ЛЕНИНГРАДСКАЯ УЛ. УГОЛ ШКОЛЬНОЙ УЛ.";"Ленинградская ул., Школьная ул.";"59,72983657";"30,4076099";"Остановка";"186,371,376,377,381"
"ЛЕНИНСКИЙ ПР. [145, 229, 210, 20, 200]";"ЛЕНИНСКИЙ ПР.";"Зины Портновой ул., Ленинский пр.";"59,85126517";"30,2560997";"Остановка";"145,145А"
"ЛЕНИНСКИЙ ПР.,100 [2]";"ЛЕНИНСКИЙ ПР.,100";"Ленинский пр., Маршала Жукова пр.";"59,85260301";"30,2173958";"Остановка";"2,2А,26"
"ЛЕНИНСКИЙ ПР.,104 [142]";"ЛЕНИНСКИЙ ПР.,104";"Ленинский пр., Маршала Жукова пр.";"59,85200956";"30,2264843";"Остановка";"26,83,142,160"
"ЛЕНИНСКИЙ ПР.,147 [114, 130]";"ЛЕНИНСКИЙ ПР.,147";"Ленинский пр., Конституции пл.";"59,8517317";"30,2988319";"Остановка";"26,62,63,114,130,156"
"ЛЕНИНСКИЙ ПР.,79 [2]";"ЛЕНИНСКИЙ ПР.,79";"Ленинский пр.";"59,85765889";"30,1951504";"Остановка";"2,2А"
"ЛЕНИНСКИЙ ПР.,УГ. ВАРШАВСКОЙ УЛ. [13, 13А, 31, 187]";"ЛЕНИНСКИЙ ПР.,УГ. ВАРШАВСКОЙ УЛ.";"Ленинский пр., ул. Варшавская";"59,85194439";"30,315361";"Остановка";"13,13А,26,31,114,130,150,155,187"
"УЛ. ЗИНЫ ПОРТНОВОЙ, УГ. ЛЕНИНСКОГО ПР.[114, 130]";"УЛ. ЗИНЫ ПОРТНОВОЙ, УГ. ЛЕНИНСКОГО ПР.";"Ленинский пр., Зины Портновой ул.";"59,85170083";"30,2572289";"Остановка";"18,26,73,114,130,142"
"ЛЕНСКАЯ УЛ. [24]";"ЛЕНСКАЯ УЛ.";"Индустриальный пр., Ленская ул.";"59,94106583";"30,4766998";"Остановка";"4М,4МА,19,21,153,169"
"ЛЕНСКАЯ УЛ.";"ЛЕНСКАЯ УЛ.";"ул. Ленская";"59,94000183";"30,4968872";"Остановка";"19,21,28,153"
"ЛЕНСКАЯ УЛ. ПО ПР. НАСТАВНИКОВ [15, 174, 21]";"ЛЕНСКАЯ УЛ. ПО ПР. НАСТАВНИКОВ";"?Наставников пр., Наставников пр.";"59,94000867";"30,4889717";"Остановка";"15,19,21,102,153,164,174"
"ЛЕНСКАЯ УЛ. УГ. БЕЛОРУССКОЙ УЛ. [15, 174]";"ЛЕНСКАЯ УЛ. УГ. БЕЛОРУССКОЙ УЛ.";"Белорусская ул., Ленская ул.";"59,93987182";"30,501709";"Остановка";"15,37,77,92,124,174"
"ЛЕРМОНТОВСКИЙ ПР. [49, 70, 6, 22, 2]";"ЛЕРМОНТОВСКИЙ ПР.";"Садовая ул., Лермонтовский пр.";"59,91975189";"30,2957382";"Остановка";"49,181"
"ЛЕСНАЯ УЛ.";"ЛЕСНАЯ УЛ.";"Морская улица, Нагорная улица";"59,90821311";"29,8096104";"Остановка";"200,348,349"
"ЛЕСНОЙ ПР. [33, 137]";"ЛЕСНОЙ ПР.";"Кантемировская ул., Лесной пр.";"59,98506716";"30,3409786";"Остановка";"33,60,137,185"
"ЛЕТНИЙ САД [49]";"ЛЕТНИЙ САД";"Лебяжьего канала наб., наб. р. Мойки";"59,94196559";"30,3352375";"Остановка";"2М,46,49"
""СТ. МЕТРО  "МОСКОВСКИЕ ВОРОТА"";"ЛИГОВСКИЙ ПР.,УГ. МОСКОВСКОГО ПР.";"Лиговский пр., Московский пр.";"59,89153128";"30,3203278";"Остановка";"3,26,64"
"ЛИТЕЙНЫЙ ПР. [3, 7, 22, 27]";"ЛИТЕЙНЫЙ ПР.";"Невский пр., Владимирский пр.";"59,93256654";"30,3494244";"Остановка";"3,22"
"ЛИТОВСКАЯ УЛ. [33]";"ЛИТОВСКАЯ УЛ.";"Полюстровский пр., Менделеевская ул.";"59,97795296";"30,3674488";"Остановка";"33"
"ЛИФЛЯНДСКАЯ УЛ. [49, 65, 66, 70, 71]";"ЛИФЛЯНДСКАЯ УЛ.";"Обводного канала наб., Бумажная ул.";"59,90878158";"30,2667198";"Остановка";"35,35А,49,65,66,67,67Б,71"
"ЛОМОНОСОВ,ВОКЗАЛ";"ЛОМОНОСОВ,ВОКЗАЛ";"Привокзальная площадь, Угольная улица";"59,91745473";"29,7702503";"Остановка";"1Л,3АЛ,3Л,4Л,6Л,7Л,175,200,347,348,349,682,683,683А,684,685А,686,687"
""МАГАЗИН "ВЕСНА" [33, 107]"";""МАГАЗИН "ВЕСНА"";"Замшина ул., Ключевая ул.";"59,9752668";"30,4013119";"Остановка";"33,107"
""МАГАЗИН "СТРОИТЕЛЬ" [7]"";""МАГАЗИН "СТРОИТЕЛЬ"";"Новосмоленская наб.";"59,94923118";"30,2245636";"Остановка";"7,7А,47,151"
"МАЛАЯ БАЛКАНСКАЯ УЛ. ПО УЛ. Я. ГАШЕКА";"МАЛАЯ БАЛКАНСКАЯ УЛ. ПО УЛ. Я. ГАШЕКА";"Ярослава Гашека ул., Малая Балканская ул.";"59,83108807";"30,3851871";"Остановка";"2М,2МА,50,53,54,56,159,326"
"МАЛАЯ БАЛКАНСКАЯ УЛ. УГ. УЛ. О. ДУНДИЧА";"МАЛАЯ БАЛКАНСКАЯ УЛ. УГ. УЛ. О. ДУНДИЧА";"ул. Малая Балканская, ул. Олеко Дундича";"59,82921043";"30,3852367";"Остановка";"2М,2МА,50,54,56,74,96,157,159"
"МАЛАЯ БУХАРЕСТСКАЯ УЛ.";"МАЛАЯ БУХАРЕСТСКАЯ УЛ.";"Дунайский пр., ул. Малая Бухарестская";"59,84441388";"30,4176083";"Остановка";"53,326"
"МАЛАЯ МОРСКАЯ УЛ. [3, 22, 24, 27]";"МАЛАЯ МОРСКАЯ УЛ.";"Малая Морская ул., Кирпичный пер.";"59,93602606";"30,3138485";"Остановка";"3,3М,3МБ,7А,10,22,24А,27,135А,191А"
"МАЛАЯ МОРСКАЯ УЛ. [7]";"МАЛАЯ МОРСКАЯ УЛ.";"Невский пр., Дворцовый проезд";"59,93679251";"30,3133526";"Остановка";"3М,3МБ,7,7А,24,24А,135,135А,191,191А"
"МАЛЫЙ ПР. В.О. [7]";"МАЛЫЙ ПР. В.О.";"Наличная ул., Малый пр. В.О.";"59,93691227";"30,2335911";"Остановка";"7,7А,128,151"
"МАЛЫЙ ПР. В.О.,УГ. НАЛИЧНОЙ УЛ. [6, 1]";"МАЛЫЙ ПР. В.О.,УГ. НАЛИЧНОЙ УЛ.";"Малый пр. В.О., Гаванская ул.";"59,93753499";"30,2360191";"Остановка";"1,3М,3МА,6,47,100"
"МАЛЬЦЕВСКИЙ РЫНОК [15, 74]";"МАЛЬЦЕВСКИЙ РЫНОК";"Некрасова ул., Фонтанная ул.";"59,93843484";"30,366766";"Остановка";"15,74"
"МАНЧЕСТЕРСКАЯ УЛ. [40, 86]";"МАНЧЕСТЕРСКАЯ УЛ.";"Энгельса пр., Манчестерская ул.";"60,01123508";"30,3247147";"Остановка";"2М,2МБ,40,86"
"КУБИНСКАЯ УЛ. [72]";"КУБИНСКАЯ УЛ.";"Краснопутиловская ул., Кубинская ул.";"59,85846145";"30,2933846";"Остановка";"72"
"МАРИИНСКИЙ ТЕАТР [22, 70, 71, 2, 3, 27]";"МАРИИНСКИЙ ТЕАТР";"Декабристов ул., Минский пер.";"59,92550951";"30,2923374";"Остановка";"2,3,6,22,27,70"
"МАСЛЯНЫЙ ПЕРЕУЛОК [65]";"МАСЛЯНЫЙ ПЕРЕУЛОК";"Обводного канала наб., Масляный пер.";"59,9099048";"30,3252201";"Остановка";"65"
"МАСТЕРОВОЙ ПЕР. [200, 210, 351, 356, 356Б, 359]";"МАСТЕРОВОЙ ПЕР.";"Санкт-Петербургский пр., Мастеровой пер.";"59,88226531";"29,8946552";"Остановка";"200,210,344,348,351,352,353,354,356,359,463,463А,489"
"МГИНСКАЯ УЛ.";"МГИНСКАЯ УЛ.";"Мгинская ул., Волковский пр.";"59,90127079";"30,3662663";"Остановка";"29,117,141"
"МГИНСКАЯ УЛ. УГОЛ НАБ. РЕКИ ВОЛКОВКИ";"МГИНСКАЯ УЛ. УГОЛ НАБ. РЕКИ ВОЛКОВКИ";"Мгинская ул., Волковский пр.";"59,90155166";"30,3654957";"Остановка";"141"
"ПОС. МЕТАЛЛОСТРОЙ,3";"ПОС. МЕТАЛЛОСТРОЙ,3";"";"59,79287941";"30,5642529";"Остановка";"115,337"
"МИЧМАНСКАЯ УЛ. [7]";"МИЧМАНСКАЯ УЛ.";"Кораблестроителей ул., Матросская ул.";"59,94632719";"30,2142067";"Остановка";"128,151,158"
"МИЧУРИНСКАЯ УЛ. [49]";"МИЧУРИНСКАЯ УЛ.";"Куйбышева ул., Мичуринская ул.";"59,95558213";"30,329052";"Остановка";"49"
"МОРДВИНОВКА";"МОРДВИНОВКА";"Морская улица, улица Левитана";"59,89925324";"29,827631";"Остановка";"200,348,349"
"МОРСКАЯ УЛ. 35 [200]";"МОРСКАЯ УЛ. 35";"";"59,90924731";"29,8035965";"Остановка";"200,348,349"
"МОСКОВСКАЯ ПЛОЩАДЬ [11, 39, 13, 13А]";"МОСКОВСКАЯ ПЛОЩАДЬ";"улица Типанова, Московский проспект";"59,85082607";"30,3227997";"Остановка";"11"
"МОСКОВСКАЯ ПЛОЩАДЬ";"МОСКОВСКАЯ ПЛОЩАДЬ";"Демонстрационный проезд, Типанова ул.";"59,85228742";"30,3247566";"Остановка";"90"
"МОСКОВСКАЯ СЛАВЯНКА";"МОСКОВСКАЯ СЛАВЯНКА";"M-10";"59,7488156";"30,4966068";"Остановка";"179,192,196"
"МОСКОВСКАЯ УЛ. [186]";"МОСКОВСКАЯ УЛ.";"Оранжерейная ул., Московская ул.";"59,71956123";"30,408392";"Остановка";"186,188,370,375,376,378,383,384,545"
"МОСКОВСКИЙ ВОКЗАЛ";"МОСКОВСКИЙ ВОКЗАЛ";"Лиговский пр., Лиговский пер.";"59,92922645";"30,3603249";"Остановка";"3,4М,4МБ,26,54,65,74,76,91,141"
"МОСКОВСКИЙ ПР. [65]";"МОСКОВСКИЙ ПР.";"Обводного канала наб., Московский пр.";"59,908309";"30,3196945";"Остановка";"65"
"МОСКОВСКИЙ ПР.,129 [3, 36, 50]";"МОСКОВСКИЙ ПР.,129";"Московский пр., Рощинская ул.";"59,88493503";"30,3193092";"Остановка";"2М,2МА,3,26,29,50,62,64"
"МОСКОВСКИЙ ПР.,4 [71]";"МОСКОВСКИЙ ПР.,4";"Московский пр., Бринько пер.";"59,92519804";"30,3176765";"Остановка";"2М,2МА,4М,4МБ,5М,5МБ,71"
"МОСКОВСКИЙ ПР.,5 [70]";"МОСКОВСКИЙ ПР.,5";"Московский пр., Бринько пер.";"59,92517408";"30,317379";"Остановка";"2М,2МА,4М,4МБ,5М,5МБ,70"
"МОСКОВСКОЕ ШОССЕ,22 КМ";"МОСКОВСКОЕ ШОССЕ,22 КМ";"M-10";"59,76503251";"30,4665546";"Остановка";"179,192,196"
"МОСКОВСКОЕ ШОССЕ,35 [34]";"МОСКОВСКОЕ ШОССЕ,35";"Московское ш.";"59,81945324";"30,3650818";"Остановка";"34,179,192"
"МУЗЕЙ А.В. СУВОРОВА [22, 136]";"МУЗЕЙ А.В. СУВОРОВА";"Кирочная ул., Таврическая ул.";"59,94372056";"30,3765736";"Остановка";"22,105,136"
"МЫТНИНСКАЯ УЛ. [15]";"МЫТНИНСКАЯ УЛ.";"8-я Советская ул., Кирилловская ул.";"59,93420909";"30,3805561";"Остановка";"15"
"МЯГЛОВО [485]";"МЯГЛОВО";"";"59,89181566";"30,6843719";"Остановка";"485"
"МЯСОКОМБИНАТ [34]";"МЯСОКОМБИНАТ";"Ленсовета ул., Московское ш.";"59,82913835";"30,3488369";"Остановка";"34,64,64А,179,192"
