Наименование остановки;Официальное наименование;Расположение;Широта;Долгота;Тип объекта;Маршруты
"Г. ПУШКИН, НОВОДЕРЕВЕНСКАЯ УЛ., УГ. УЛ. УДАЛОВСКОГО";"";"ул. Удаловская, ул. Новодеревенская";"59,72146916";"30,4318771";"Остановка";"179,375,375А"
"НАБ. ОБВОДНОГО КАНАЛА";"НАБ. ОБВОДНОГО КАНАЛА";"Московский пр., Угловой пер.";"59,90976098";"30,3185711";"Остановка";"2М,2МА"
"5-Я КРАСНОАРМЕЙСКАЯ УЛ.";"5-Я КРАСНОАРМЕЙСКАЯ УЛ.";"Клинский пр., Московский пр.";"59,9133838";"30,3184185";"Остановка";"2М,2МА"
"ПР.ЭНГЕЛЬСА, УГ. ПР. ЛУНАЧАРСКОГО";"ПР.ЭНГЕЛЬСА, УГ. ПР. ЛУНАЧАРСКОГО";"пр. Энгельса, пр. Луначарского";"60,04427569";"30,3291378";"Остановка";"2М,2МБ"
""СТ. МЕТРО "ПР.ПРОСВЕЩЕНИЯ"";""СТ. МЕТРО "ПР.ПРОСВЕЩЕНИЯ"";"пр. Энгельса, пр. Просвещения";"60,05348964";"30,3357601";"Остановка";"2М,2МБ"
"АНИСИМОВСКАЯ ДОРОГА, УГ. УМАНСКОГО ПЕР.";"АНИСИМОВСКАЯ ДОРОГА, УГ. УМАНСКОГО ПЕР.";"Уманский переулок";"59,96516953";"30,4520397";"Остановка";"19,131"
"АНИСИМОВСКАЯ ДОРОГА, 41, ПО ТРЕБОВАНИЮ";"АНИСИМОВСКАЯ ДОРОГА, 41, ПО ТРЕБОВАНИЮ";"Уманский переулок, Анисимовская дорога";"59,97397832";"30,4474201";"Остановка";"19,131"
"АНИСИМОВСКАЯ ДОРОГА, 41, ПО ТРЕБОВАНИЮ";"АНИСИМОВСКАЯ ДОРОГА, 41, ПО ТРЕБОВАНИЮ";"Уманский переулок, Анисимовская дорога";"59,97366388";"30,4468937";"Остановка";"19,131"
"ВОКЗАЛЬНАЯ ПЛ.";"";"ул. Октябрьская, Банковский переулок";"59,74935583";"30,61203";"Остановка";"387"
"ДОМОСТРОИТЕЛЬНЫЙ КОМБИНАТ №5";"ДОМОСТРОИТЕЛЬНЫЙ КОМБИНАТ №5";"Дорога на ДСК, ул. Финляндская";"59,75338837";"30,5522118";"Остановка";"364,367,368,394"
"УЛ. ТРУДА, 24";"";"ул. Загородная, ул. Речная";"59,79560097";"30,6015396";"Остановка";"332,336,337А"
"ПОС. ПОНТОННЫЙ, ДОРОГА НА ФАНЕРНЫЙ ЗАВОД";"";"Петрозаводское шоссе, ул. Пролетарской Победы";"59,79060784";"30,6162586";"Остановка";"332,335,335А,336"
"26 КМ";"";"Петрозаводское шоссе, ул. Александра Товпеко";"59,7930856";"30,6111526";"Остановка";"335,335А,336"
"УЛ. ТРУДА, 24";"";"ул. Загородная, ул. Речная";"59,795357";"30,6012726";"Остановка";"332,336,337А"
"САПЁРНЫЙ ПЕР.";"";"ул. Загородная, Сапёрный переулок";"59,76048885";"30,5981064";"Остановка";"332,336,337А,387"
"ВЕЛОТРЕК";"ВЕЛОТРЕК";"проспект Энгельса, ул. Олонецкая";"60,02385058";"30,319685";"Остановка";"86"
"УЛ. РАШЕТОВА";"";"проспект Энгельса, ул. Рашетова";"60,02077224";"30,3205318";"Остановка";"86"
"СЕРДОБОЛЬСКАЯ УЛ.";"СЕРДОБОЛЬСКАЯ УЛ.";"Большой Сампсониевский проспект, ул. Сердобольская";"59,99451623";"30,3314266";"Остановка";"86"
"Мичманская ул.";"Мичманская ул.";"ул. Кораблестроителей, ул. Боцманская";"59,94516073";"30,213728";"Остановка";"7,7А,41"
"УЛ. КОМИССАРА СМИРНОВА";"УЛ. КОМИССАРА СМИРНОВА";"Лесной проспект, ул. Комиссара Смирнова";"59,96232164";"30,3518486";"Остановка";"1М,86"
"ШКИПЕРСКИЙ ПРОТОК, УГ. НАЛИЧНОЙ УЛ.";"ШКИПЕРСКИЙ ПРОТОК, УГ. НАЛИЧНОЙ УЛ.";"Шкиперский проток, Наличная ул.";"59,93339125";"30,2365093";"Остановка";"7,7А"
""СТ. МЕТРО "ОЗЕРКИ"";""СТ. МЕТРО "ОЗЕРКИ"";"проспект Энгельса, Выборгское шоссе";"60,03621905";"30,322998";"Остановка";"86"
"ДОРОГА НА ПОС. ПЕТРО-СЛАВЯНКУ";"ДОРОГА НА ПОС. ПЕТРО-СЛАВЯНКУ";"Центральный проезддорога на Металлострой";"59,79611296";"30,5588036";"Остановка";"396А"
"УЛ. АДМИРАЛА ТРИБУЦА";"УЛ. АДМИРАЛА ТРИБУЦА";"Петергофское шоссе, ул. Адмирала Трибуца";"59,84766987";"30,1479053";"Остановка";"160"
"УЛ. КАТЕРНИКОВ";"УЛ. КАТЕРНИКОВ";"Петергофское шоссе, ул. Катерников";"59,84748461";"30,1563816";"Остановка";"160"
"СМОЛЬНЫЙ";"СМОЛЬНЫЙ";"площадь Растрелли, ул. Смольного";"59,94893361";"30,392065";"Остановка";"2С,1С-1"
"МЕДИЦИНСКОЕ УЧРЕЖДЕНИЕ";"МЕДИЦИНСКОЕ УЧРЕЖДЕНИЕ";"Крестовский проспект, Рюхина ул.";"59,96896064";"30,2600975";"Остановка";"14,135,135А"
"НОВОЛАДОЖСКАЯ УЛ.";"НОВОЛАДОЖСКАЯ УЛ.";"ул. Ждановская, Мало-Петровский мост";"59,96093008";"30,2730103";"Остановка";"135,135А"
"ПЕТРОВСКИЙ ПЕР.";"ПЕТРОВСКИЙ ПЕР.";"ул. Ждановская, Петровский переулок";"59,95829041";"30,2791405";"Остановка";"135,135А"
"СТАДИОН ПЕТРОВСКИЙ";"СТАДИОН ПЕТРОВСКИЙ";"ул. Ждановская, Ждановская наб.";"59,95428263";"30,2861614";"Остановка";"135,135А"
"СТАДИОН ПЕТРОВСКИЙ";"СТАДИОН ПЕТРОВСКИЙ";"ул. Ждановская, Ждановская наб.";"59,95452544";"30,2861443";"Остановка";"135,135А"
"ПЕТРОВСКИЙ ПЕР.";"ПЕТРОВСКИЙ ПЕР.";"ул. Ждановская, Петровский переулок";"59,95814679";"30,2799015";"Остановка";"135,135А"
"КРЕСТОВСКИЙ ПР.";"КРЕСТОВСКИЙ ПР.";"Крестовский проспект, ул. Спортивная";"59,96968531";"30,2687836";"Остановка";"14,135,135А"
"ДАЛЬНЕВОСТОЧНЫЙ ПР.";"ДАЛЬНЕВОСТОЧНЫЙ ПР.";"ул. Коллонтай, Дальневосточный проспект";"59,91302085";"30,4410439";"Остановка";"191А"
"Смольный";"";"аллея Смольного, Смольный проезд";"59,94632035";"30,3951302";"Остановка";"3С,5С-1"
"ГРАНИТНАЯ УЛ.";"ГРАНИТНАЯ УЛ.";"Новочеркасский проспект, ул. Гранитная";"59,91976217";"30,4227695";"Остановка";"191А"
"ТУРИСТСКАЯ УЛ., 18";"ТУРИСТСКАЯ УЛ., 18";"ул. Туристская, ул. Мебельная";"59,99728622";"30,2064705";"Остановка";"126,154А,172"
"МЕБЕЛЬНАЯ УЛ., 25";"МЕБЕЛЬНАЯ УЛ., 25";"ул. Мебельная, Приморское шоссе";"59,99509006";"30,2118835";"Остановка";"125,154А"
"СЫЗРАНСКАЯ УЛ.";"";"ул. Благодатная, ул. Сызранская";"59,87628424";"30,3380375";"Остановка";"12,29,95,159"
"УЛ. БАДАЕВА, 3";"";"ул. Бадаева, ул. Джона Рида";"59,91793746";"30,4511833";"Остановка";"12"
"УЛ. БАДАЕВА, 8";"";"ул. Бадаева";"59,91889262";"30,4473305";"Остановка";"12"
"УЛ. ДЖОНА РИДА";"";"проспект Пятилеток, ул. Джона Рида";"59,92305529";"30,456316";"Остановка";"12"
"5-Я ЛИНИЯ В.О.";"5-Я ЛИНИЯ В.О.";"4-5-я линии, Малый проспект В.О.";"59,94703867";"30,2772903";"Остановка";"47,1"
"Б. САМПСОНИЕВСКИЙ ПР.";"Б. САМПСОНИЕВСКИЙ ПР.";"Гренадерская ул., Большой Сампсониевский проспект";"59,96879656";"30,3407021";"Остановка";"14"
"КРАСНОГОРОДСКАЯ УЛ.";"КРАСНОГОРОДСКАЯ УЛ., УГ. ГАТЧИНСКОГО ШОССЕ";"ул. Красногородская, Гатчинское шоссе";"59,71776341";"30,0799522";"Остановка";"144,145А"
"ГАТЧИНСКОЕ ШОССЕ";"КРАСНОГОРОДСКАЯ УЛ., УГ. ГАТЧИНСКОГО ШОССЕ";"Гатчинское шоссе, ул. Красногородская";"59,71790463";"30,0804405";"Остановка";"145А,477"
"НАРВСКАЯ УЛ.";"НАРВСКАЯ УЛ., 2";"ул. Нарвская, Кингисеппское шоссе";"59,72118677";"30,0680428";"Остановка";"145А"
"ЮЖНО-ПРИМОРСКИЙ ПАРК";"ЮЖНО-ПРИМОРСКИЙ ПАРК";"Петергофское шоссе, ул. Доблести";"59,84649308";"30,1743412";"Остановка";"160,162,200,210"
"АЛЛЕЯ СЛАВЫ";"АЛЛЕЯ СЛАВЫ";"Петергофское шоссе, ул. Партизана Германа";"59,84621861";"30,176466";"Остановка";"200,21"
"УЛ. ТАМБАСОВА";"УЛ. ТАМБАСОВА";"Петергофское шоссе, 1-й Петергофский мост";"59,84675383";"30,1581821";"Остановка";"160,162,200,210"
"УЛ. ТАМБАСОВА";"УЛ. ТАМБАСОВА";"Петергофское шоссе, 1-й Петергофский мост";"59,84658229";"30,1593533";"Остановка";"162,200,210"
"ПЕТЕРГОФСКОЕ ШОССЕ, 5";"ПЕТЕРГОФСКОЕ ШОССЕ, 5";"Петергофское шоссе";"59,84588923";"30,2020416";"Остановка";"200,21"
"ПЕТЕРГОФСКОЕ ШОССЕ, 5";"ПЕТЕРГОФСКОЕ ШОССЕ, 5";"Петергофское шоссе";"59,84571768";"30,2024384";"Остановка";"200,21"
"ШКОЛА № 445";"ШКОЛА № 445";"проспект Ленина, Исполкомская улица";"60,19303386";"29,7022877";"Остановка";"211,213,318,319,322,415Ш,420,420А"
"ИНСТИТУТ ГЕНЕТИКИ (ТЕСТ)";"ИНСТИТУТ ГЕНЕТИКИ";"Московское ш.";"59,71178376";"30,4520206";"Остановка";"384"
"Б. ГЛИНКИ (ТЕСТ)";"Б. ГЛИНКИ";"";"59,67974552";"30,4969864";"Остановка";"493"
"5 КМ (ТЕСТ)";"5 КМ";"";"59,66125168";"30,5300827";"Остановка";"493"
""Ж.-Д. СТ. "МОРСКАЯ" <"";""Ж.-Д. СТ. "МОРСКАЯ"";"Приморское ш.";"60,00270597";"30,06987";"Остановка";"120,211,216"
"МАГАЗИННАЯ УЛ.";"МАГАЗИННАЯ УЛ.";"Мосина ул., Магазинная ул.";"60,08651526";"29,966486";"Остановка";"307"
"ПРИМОРСКОЕ ШОССЕ, 285 (тест)";"ПРИМОРСКОЕ ШОССЕ, 285";"Приморское ш., Ново-Гагаринская ул.";"60,08306464";"29,958746";"Остановка";"310,311,312"
"777 КМ";"777 КМ";"A-122";"60,34289185";"29,7802677";"Остановка";"410"
"ПОС. МОЛОДЕЖНОЕ, ПОЧТА <";"ПОС. МОЛОДЕЖНОЕ, ПОЧТА";"A-123";"60,19284034";"29,5191498";"Остановка";"213,420,420А,420Б"
"УЛ. КОТИНА ПО УЛ. МАРШАЛА КАЗАКОВА";"УЛ. КОТИНА ПО УЛ. МАРШАЛА КАЗАКОВА";"Маршала Казакова ул., Котина ул.";"59,86028257";"30,2123375";"Остановка";"26,3"
"4 КМ, КЛУБ [75]";"4 КМ, КЛУБ";"Горское шоссе";"60,09329282";"30,192131";"Остановка";"75,84,84А,84-ШК"
"ПОС. ЛЕВАШОВО, УЛ. КАРПОВА [75]<";"ПОС. ЛЕВАШОВО, УЛ. КАРПОВА";"пр. Володарского";"60,09824399";"30,2050323";"Остановка";"75,84,84А,84-ШК"
"УШКОВСКАЯ УЛ.";"УШКОВСКАЯ УЛ.";"Большая Озёрная улица, Ушковская улица";"60,03377643";"30,3124924";"Остановка";"38"
"ГОСТИЛИЦКОЕ ШОССЕ, 5 КМ (тест)";"ГОСТИЛИЦКОЕ ШОССЕ, 5 КМ";"Гостилицкое ш.";"59,86539557";"29,8142605";"Остановка";"344,463,463А,489,682,683,683А,684,685А,686,687"
"ДЕР. ЛОПУХИНКА, МАГАЗИН (тест)";"ДЕР. ЛОПУХИНКА, МАГАЗИН";"";"59,72991231";"29,4075127";"Остановка";"463,684,685А,686"
"КРАСНАЯ УЛ. (ТЕСТ) <";"КРАСНАЯ УЛ.";"Сельская улица, Красная улица";"60,12756115";"30,1536865";"Остановка";"315"
"ДОРОГА НА БЕЛЬВЕДЕР";"ДОРОГА НА БЕЛЬВЕДЕР";"Бабигонское ш.";"59,84512411";"29,8765697";"Остановка";"360"
"УЛ. МАРШАЛА ЗАХАРОВА, 14";"УЛ. МАРШАЛА ЗАХАРОВА, 14";"";"59,85799501";"30,1639938";"Остановка";"2А,83,142"
"ВИТЕБСКИЙ ПР.";"";"ул. Благодатная, Витебский проспект";"59,87770677";"30,3459187";"Остановка";"12,29,95,159"
"ЗАВОД СОКОЛ";"ЗАВОД СОКОЛ";"";"59,69075695";"30,808651";"Остановка";"438,438З,540"
"УЛЬЯНОВКА, РЕЧНАЯ УЛ.";"УЛЬЯНОВКА, РЕЧНАЯ УЛ.";"проспект Володарского, Школьная  ул.";"59,63342964";"30,7632275";"Остановка";"438"
"УЛ. КОСТЮШКО";"";"ул. Галстяна, ул. Костюшко";"59,84141149";"30,3113461";"Остановка";"13,13А,31,150,155,187"
"БЕСТУЖЕВСКАЯ УЛ., 32";"БЕСТУЖЕВСКАЯ УЛ., 32";"Бестужевская улица, Замшина улица";"59,98215948";"30,4129677";"Остановка";"136"
"НАБ. ЧЁРНОЙ РЕЧКИ";"НАБ. ЧЁРНОЙ РЕЧКИ";"наб.Чёрной речки, ул. Сердобольская";"59,98476308";"30,3154907";"Остановка";"25,25А,32,33,46,137"
"КРАСНОГОРОДСКАЯ УЛ.";"КРАСНОГОРОДСКАЯ УЛ.";"Гатчинское шоссе, ул. Красногородская";"59,71760154";"30,080286";"Остановка";"477"
"ЛЕНИНСКИЙ ПР.";"ЛЕНИНСКИЙ ПР.";"ул. Десантников, Ленинский проспект";"59,85591652";"30,2021198";"Временная";"300"
"УЛ. МАРШАЛА ЗАХАРОВА";"УЛ. МАРШАЛА ЗАХАРОВА";"ул. Десантников, ул. Маршала Захарова";"59,85259615";"30,1998653";"Остановка";"300"
"УЛ. РИХАРДА ЗОРГЕ";"УЛ. РИХАРДА ЗОРГЕ";"ул. Десантников, ул. Рихарда Зорге";"59,85001303";"30,1971169";"Временная";"300"
"УЛ. НАХИМОВА, 11";"УЛ. НАХИМОВА, 11";"ул. Нахимова, Наличный переулок";"59,94105215";"30,2234745";"Остановка";"7,7А,42,128,152"
"НОВОЛАДОЖСКАЯ УЛ.";"НОВОЛАДОЖСКАЯ УЛ.";"ул. Ждановская, Новоладожская ул.";"59,96079673";"30,2739735";"Остановка";"135,135А"
""СТ. МЕТРО "ПР.ПРОСВЕЩЕНИЯ"";""СТ. МЕТРО "ПР.ПРОСВЕЩЕНИЯ"";"пр. Энгельса, пр. Просвещения";"60,05219398";"30,3340321";"Остановка";"2М,2МБ"
"5-Я КРАСНОАРМЕЙСКАЯ УЛ.";"5-Я КРАСНОАРМЕЙСКАЯ УЛ.";"Московский пр., Клинский пр.";"59,91356528";"30,3179665";"Остановка";"2М,2МА"
"НАБ. ОБВОДНОГО КНАЛА";"НАБ. ОБВОДНОГО КНАЛА";"Московский пр., Угловой пер.";"59,90943908";"30,3182163";"Остановка";"2М,2МА"
"ПР. КОРОЛЁВА";"ПР. КОРОЛЁВА";"пр. Сизова, пр. Королева";"60,01151844";"30,2753983";"Остановка";"5М,5МА"
"КИЕВСКАЯ УЛ.";"КИЕВСКАЯ УЛ.";"Московский пр., ул. Красуцкого";"59,90215793";"30,3182468";"Остановка";"2М,2МА"
"ТРАМПАРК №1";"ТРАМПАРК №1";"Московский пр., ул. Митрофаньевская малая";"59,89799263";"30,3185825";"Остановка";"2М,2МА"
"ДЕТСКАЯ МУЗЫКАЛЬНАЯ ШКОЛА";"ДЕТСКАЯ МУЗЫКАЛЬНАЯ ШКОЛА";"Московский пр., Детский пер.";"59,89453943";"30,318943";"Остановка";"2М,2МА"
""СТ. МЕТРО "ПЛ. МУЖЕСТВА"";""СТ. МЕТРО "ПЛ. МУЖЕСТВА"";"ул. Политехническая, Мужества пл.";"59,99969055";"30,3651466";"Остановка";"1М,1МА"
""СТ. МЕТРО "ПЛ. МУЖЕСТВА"";""СТ. МЕТРО "ПЛ. МУЖЕСТВА"";"ул. Политехническая, Мужества пл.";"59,99967006";"30,3653316";"Остановка";"1М,1МА"
"УЛ. КАРБЫШЕВА, 10";"УЛ. КАРБЫШЕВА, 10";"улица Карбышева, площадь Мужества";"59,99767215";"30,3621826";"Остановка";"1М,1МА"
""СТ. МЕТРО "ЛЕСНАЯ"";""СТ. МЕТРО "ЛЕСНАЯ"";"Лесной пр., ул. Кантемировская";"59,98538149";"30,3422146";"Остановка";"1М,1МА"
"УЛ. АЛЕКСАНДРА МАТРОСОВА";"УЛ. АЛЕКСАНДРА МАТРОСОВА";"Лесной пр., ул. Александра Матросова";"59,98213556";"30,3429108";"Остановка";"1М,1МА"
"БОТКИНСКАЯ УЛ.";"БОТКИНСКАЯ УЛ.";"ул. Академика Лебедева, ул. Боткинская";"59,95868706";"30,3529987";"Остановка";"1М,86"
"БОТКИНСКАЯ УЛ., 25";"БОТКИНСКАЯ УЛ., 25";"ул. Боткинская, ул. доктора Короткова";"59,95930595";"30,3474178";"Остановка";"1МА,49"
"ВЕРЕЙСКАЯ УЛ.";"ВЕРЕЙСКАЯ УЛ.";"Загородный проспект, Верейская улица";"59,91858793";"30,3234825";"Остановка";"1М,1МБ,4М,4МБ,5М,5МБ"
"УЛ. ЧАЙКОВСКОГО";"УЛ. ЧАЙКОВСКОГО";"Литейный пр., ул. Чайковского";"59,94690527";"30,3486404";"Остановка";"1М"
"УЛ. ЧАЙКОВСКОГО";"УЛ. ЧАЙКОВСКОГО";"Литейный пр., ул. Чайковского";"59,94699763";"30,3488598";"Остановка";"1М,1МБ"
""СТ. МЕТРО "ЧЕРНЫШЕВСКАЯ"";""СТ. МЕТРО "ЧЕРНЫШЕВСКАЯ"";"ул. Кирочная, пр. Чернышевского";"59,94382319";"30,3578205";"Остановка";"1М"
""СТ. МЕТРО "ЧЕРНЫШЕВСКАЯ"";""СТ. МЕТРО "ЧЕРНЫШЕВСКАЯ"";"ул. Кирочная, пр. Чернышевского";"59,94399423";"30,3578014";"Остановка";"1М,1МБ"
"НЕВСКИЙ ПР.";"НЕВСКИЙ ПР.";"Литейный пр., Невский пр.";"59,93331596";"30,3478107";"Остановка";"1М,1МБ"
"РАЗЪЕЗЖАЯ УЛ.";"РАЗЪЕЗЖАЯ УЛ.";"Загородный пр., ул. Ломоносова";"59,92581756";"30,3411007";"Остановка";"1М,1МБ,4М,4МБ"
"ЗВЕНИГОРОДСКАЯ УЛ.";"ЗВЕНИГОРОДСКАЯ УЛ.";"Загородный пр., Джамбула пер.";"59,92408903";"30,3369827";"Остановка";"1М,1МБ,4М,4МБ"
"ТЕХНОЛОГИЧЕСКИЙ ИНСТИТУТ";"ТЕХНОЛОГИЧЕСКИЙ ИНСТИТУТ";"Загородный пр., ул. Бронницкая";"59,91755401";"30,3198719";"Остановка";"1М,1МБ,4М,4МБ,5М,5МБ"
""СТ. МЕТРО "ТЕХНОЛОГИЧЕСКИЙ ИНСТИТУТ"";""СТ. МЕТРО "ТЕХНОЛОГИЧЕСКИЙ ИНСТИТУТ"";"ул. 1-я Красноармейская, Московский пр.";"59,9160921";"30,3170795";"Остановка";"1М,1МБ"
"ЗВЕНИГОРОДСКАЯ УЛ.";"ЗВЕНИГОРОДСКАЯ УЛ.";"Загородный пр., ул. Бородинская";"59,92359955";"30,3362103";"Остановка";"1М,1МБ,4М"
"РАЗЪЕЗЖАЯ УЛ.";"РАЗЪЕЗЖАЯ УЛ.";"Загородный пр., ул. Рубинштейна";"59,9262899";"30,3428879";"Остановка";"1М,1МБ"
""СТ. МЕТРО "ВЛАДИМИРСКАЯ"";""СТ. МЕТРО "ВЛАДИМИРСКАЯ"";"ул. Бол. Московская, Загородный пр.";"59,92849062";"30,3477497";"Остановка";"1М,1МБ"
"УЛ. КОМСОМОЛА";"УЛ. КОМСОМОЛА";"ул. Академика Лебедева, ул. Клиническая";"59,95505892";"30,3508587";"Остановка";"1М"
"НЕШЛОТСКИЙ ПЕР.";"НЕШЛОТСКИЙ ПЕР.";"Лесной пр., Нейшлотский пер.";"59,96775737";"30,349905";"Остановка";"1М"
""СТ. МЕТРО "ЛИГОВСКИЙ ПР."";""СТ. МЕТРО "ЛИГОВСКИЙ ПР."";"Лиговский пр., ул. Разъезжая";"59,92103906";"30,3539181";"Остановка";"5М,5МБ"
""СТ. МЕТРО "ОБВОДНЫЙ КАНАЛ"";""СТ. МЕТРО "ОБВОДНЫЙ КАНАЛ"";"Лиговский пр., ул. Тюшина";"59,91648241";"30,3516941";"Остановка";"5М,5МБ"
""СТ. МЕТРО "ЛИГОВСКИЙ ПР."";"";"Лиговский пр., Транспортный пер.";"59,92135742";"30,3547955";"Остановка";"4М,4МБ,5М,5МБ"
""СТ. МЕТРО "ЛИГОВСКИЙ ПР."";""СТ. МЕТРО "ЛИГОВСКИЙ ПР."";"ул. Разъезжая, ул. Коломенская";"59,92206602";"30,3519955";"Остановка";"4М"
""СТ. МЕТРО "ЗВЕНИГОРОДСКАЯ"";""СТ. МЕТРО "ЗВЕНИГОРОДСКАЯ"";"ул. Звенигородская, Загородный пр.";"59,92312717";"30,3356361";"Остановка";"5М,5МБ"
"БЕРЕЗОВАЯ УЛ., УГ. ДЕТСКОСЕЛЬСКОЙ УЛ.";"";"ул. Берёзовая, ул. Мичурина";"59,68607564";"30,4324646";"Остановка";"338,370,372,375А,379,383,545"
""СТ. МЕТРО "ЛЕСНАЯ"";""СТ. МЕТРО "ЛЕСНАЯ"";"Лесной проспект, ул. Кантемировская";"59,98453075";"30,3419266";"Остановка";"1М,1МА"
""СТ. МЕТРО "ВЫБОРГСКАЯ"";""СТ. МЕТРО "ВЫБОРГСКАЯ"";"Лесной проспект, ул. Гренадерская";"59,9698152";"30,3486252";"Остановка";"1М,1МА"
""СТ. МЕТРО "ПЛ. ЛЕНИНА"";""СТ. МЕТРО "ПЛ. ЛЕНИНА"";"ул. Академика Лебедева, ул. Боткинская";"59,95838615";"30,3532219";"Остановка";"1М"
""СТ. МЕТРО "ВЫБОРГСКАЯ"";""СТ. МЕТРО "ВЫБОРГСКАЯ"";"Лесной проспект, улица Смолячкова";"59,97207114";"30,3482113";"Остановка";"1М,1МА"
"УЛ. АЛЕКСАНДРА МАТРОСОВА";"УЛ. АЛЕКСАНДРА МАТРОСОВА";"Лесной проспект, ул. Александра Матросова";"59,98213556";"30,3435764";"Остановка";"1М,1МА"
"БАЛТИЙСКИЙ ВОКЗАЛ";"БАЛТИЙСКИЙ ВОКЗАЛ";"набережная Обводного канала, Лермонтовский проспект";"59,90933293";"30,2970257";"Остановка";"1МБ"
"Ж.-Д. СТ. СТАРЫЙ ПЕТЕРГОФ";"Ж.-Д. СТ. СТАРЫЙ ПЕТЕРГОФ";"ул. Халтурина, бульвар Красных Курсантов";"59,88032886";"29,8641281";"Остановка";"349,353"
"САДОВАЯ УЛ., УГ. ГОСПИТАЛЬНОЙ УЛ.";"";"ул. Госпитальная, ул. Садовая";"59,68565505";"30,4453564";"Остановка";"370,372,375А,383"
"КОНЮШЕННАЯ УЛ., УГ. САДОВОЙ УЛ.";"";"ул. Конюшенная, ул. Садовая";"59,68662723";"30,4437046";"Остановка";"370,372"
"ГУММОЛОСАРОВСКАЯ УЛ.";"";"ул. Гуммолосаровская, ул. Васенко";"59,68268662";"30,4353676";"Остановка";"370,372,375А,379"
"РОССИЙСКИЙ ПР., 14";"";"Российский проспект, ул. Чудновского";"59,92815864";"30,4733238";"Остановка";"4М,4МА"
"Морской вокзал № 4";"";"";"59,95275052";"30,1880951";"Остановка";"158"
"Морской вокзал № 3";"";"";"59,94912857";"30,1961098";"Остановка";"158"
"Морской вокзал № 2";"";"";"59,94543097";"30,1931286";"Остановка";"158"
"Морской вокзал № 1";"";"";"59,94378556";"30,183836";"Остановка";"158"
"ПУШКИНСКАЯ УЛ., УГ. ДВОРЦОВОЙ УЛ.";"";"ул. Дворцовая, ул. Пушкинская";"59,72351472";"30,3995304";"Остановка";"371"
"ПЕТЕРБУРГСКОЕ ШОССЕ, УГ. ЛЕНИНГРАДСКОЙ УЛ.";"";"Ленинградская ул., сдт Пенсионер 5-я линия";"59,73337918";"30,3959923";"Остановка";"371"
"ВОКЗАЛ";"";"ул. Железнодорожная, Софийский бульвар";"59,72248851";"30,428791";"Остановка";"370,371,375,377,380,382,384"
"ГЕОЛОГИЧЕСКАЯ УЛ.";"ГЕОЛОГИЧЕСКАЯ УЛ.";"ул. Геологическая, ул. Спирина";"59,74768349";"30,0823765";"Остановка";"149"
