Наименование остановки;Официальное наименование;Расположение;Широта;Долгота;Тип объекта;Маршруты
"ШЛИССЕЛЬБУРГСКИЙ ПР.,1 [115, 115, А]<";"ШЛИССЕЛЬБУРГСКИЙ ПР.,1";"Шлиссельбургский пр., ул. Караваевская";"59,84185414";"30,4890079";"Остановка";"3М,3МБ,51,115,115А,189,327"
"ШЛИССЕЛЬБУРГСКИЙ ПР.,43 [115, 115, А]<";"ШЛИССЕЛЬБУРГСКИЙ ПР.,43";"Шлиссельбургский проспект, улица Веры Фигнер";"59,8325194";"30,5193176";"Остановка";"115,115А,189,327"
"ШЛИССЕЛЬБУРГСКИЙ ПР.,УГ. ПРИБРЕЖНОЙ УЛ. [115, 115, А]<";"ШЛИССЕЛЬБУРГСКИЙ ПР.,УГ. ПРИБРЕЖНОЙ УЛ.";"Прибрежная ул., Шлиссельбургский пр.";"59,83548141";"30,5081806";"Остановка";"3М,3МБ,115,115А,189,327"
"ШЛИССЕЛЬбУРГСКИЙ ПР.,УНИВЕРСАМ [115, 115, А]<";"ШЛИССЕЛЬБУРГСКИЙ ПР.,УНИВЕРСАМ";"Шлиссельбургский пр., Рыбацкий пр.";"59,84027566";"30,4946709";"Остановка";"3М,3МБ,51,115,115А,189,327"
"ШЛИССЕЛЬБУРГСКИЙ ПР.,ШКОЛА [115, 115, А]<";"ШЛИССЕЛЬБУРГСКИЙ ПР.,ШКОЛА";"Шлиссельбургский пр., ул. Веры Фигнер";"59,83411198";"30,5144005";"Остановка";"115,115А,189,327"
"ШОССЕ РЕВОЛЮЦИИ [22, 123, 136]<";"ШОССЕ РЕВОЛЮЦИИ";"Энергетиков пр., Революции ш.";"59,96122754";"30,4382496";"Остановка";"22,82,102,103,106,123,131,136,183"
"ШОССЕ РЕВОЛЮЦИИ [132]<";"ШОССЕ РЕВОЛЮЦИИ";"Металлистов пр., Революции ш.";"59,95901531";"30,4222565";"Остановка";"132"
"ШОССЕ РЕВОЛЮЦИИ,116 [153, 102, 103]<";"ШОССЕ РЕВОЛЮЦИИ,116";"Революции ш., ш. Революции";"59,96576096";"30,476181";"Остановка";"37,102,103,168"
"ШОССЕ РЕВОЛЮЦИИ,88 [153, 102, 103]<";"ШОССЕ РЕВОЛЮЦИИ,88";"Революции ш., Индустриальный пр.";"59,96262934";"30,4627705";"Остановка";"28,37,102,103,153"
"ШУВАЛОВКА,УЛ. МАКАРОВА [210, 359, 200]<";"ШУВАЛОВКА,УЛ. МАКАРОВА";"Санкт-Петербургское ш.";"59,86749061";"29,9772358";"Остановка";"200,210,359"
"ШУВАЛОВСКОЕ КЛАДБИЩЕ [435, 555]<";"ШУВАЛОВСКОЕ КЛАДБИЩЕ";"Выборгское ш., Петровская ул.";"60,05370103";"30,3090668";"Остановка";"75,109,109А,148,167,173,397,433,435,436,555,567"
"ШУНДОРОВО [482, 482в, 487, 487, 487а]<";"ШУНДОРОВО";"Таллинское ш.";"59,63780414";"29,6051788";"Остановка";"482,482В,487"
"ЭРЛЕРОВСКИЙ БУЛЬВАР [351]<";"ЭРЛЕРОВСКИЙ БУЛЬВАР";"Аврова ул.";"59,8702918";"29,9190254";"Остановка";"278,351,352,355,356Б,357А"
"ЭРЛЕРОВСКИЙ БУЛЬВАР ПО УЛ. АВРОВА [355]<";"ЭРЛЕРОВСКИЙ БУЛЬВАР ПО УЛ. АВРОВА";"улица Аврова, Эрлеровский бульвар";"59,87052836";"29,9193134";"Остановка";"344,356"
"ЭРЛЕРОВСКИЙ БУЛЬВАР,УГ. УЛ. АВРОВА [356Б, 356, 355]<";"ЭРЛЕРОВСКИЙ БУЛЬВАР,УГ. УЛ. АВРОВА";"Аврова ул.";"59,8702918";"29,9180603";"Остановка";"350,354"
"ЯКОРНАЯ УЛ. [123]<";"ЯКОРНАЯ УЛ.";"Энергетиков пр., Якорная ул.";"59,94350847";"30,4355412";"Остановка";"82,123"
"ЯКОРНАЯ УЛ. УГ. ПР. МЕТАЛЛИСТОВ [132]<";"ЯКОРНАЯ УЛ. УГ. ПР. МЕТАЛЛИСТОВ";"Якорная ул., Металлистов пр.";"59,94277638";"30,418911";"Остановка";"132"
"ЯХТЕННАЯ УЛ. [154, 172]<";"ЯХТЕННАЯ УЛ.";"Камышовая ул., Яхтенная ул.";"60,00847992";"30,2270775";"Остановка";"125,166,172"
"СОФИЙСКАЯ УЛ.";"СОФИЙСКАЯ УЛ.";"Славы пр., Софийская ул.";"59,8654813";"30,4135799";"Остановка";"5М,5МБ,11,56,76,141"
"СОФИЙСКАЯ УЛ. [116, 31]<";"СОФИЙСКАЯ УЛ.";"Белы Куна ул., Софийская ул.";"59,87743255";"30,3960228";"Остановка";"12,31,95,116"
"СОФИЙСКАЯ УЛ. 43 [12, 114]<";"СОФИЙСКАЯ УЛ. 43";"Софийская ул.";"59,87268479";"30,4047966";"Остановка";"12,91,114,117,141"
"СОФИЙСКАЯ УЛ. 55 [12, 114]<";"СОФИЙСКАЯ УЛ. 55";"Софийская ул.";"59,86926667";"30,409874";"Остановка";"12,91,114,117,141"
"СОФИЙСКАЯ УЛ. УГ. ПР. СЛАВЫ [12]<";"СОФИЙСКАЯ УЛ. УГ. ПР. СЛАВЫ";"Славы пр., Софийская ул.";"59,8661808";"30,4169846";"Остановка";"5М,5МБ,12,76,91,140"
"С-ПЕТЕРБУРГ ДОРОГА НА УСТЬ-ИЖОРУ";"С-ПЕТЕРБУРГ ДОРОГА НА УСТЬ-ИЖОРУ";"Советский пр., Шлиссельбургское ш.";"59,82285244";"30,5587215";"Остановка";"115,115А,189,327"
"С-ПЕТЕРБУРГ,ОКТЯБРЬСКАЯ УЛ. [482а]<";"С-ПЕТЕРБУРГ,ОКТЯБРЬСКАЯ УЛ.";"Таллинское ш.";"59,71695402";"30,047451";"Остановка";"481,482,482А,482В,484,484Б,547"
"САНКТ-ПЕТЕРБУРГСКОЕ ШОССЕ, 26КМ";"САНКТ-ПЕТЕРБУРГСКОЕ ШОССЕ, 26КМ";"Санкт-Петербургское ш.";"59,86434286";"29,9845448";"Остановка";"200,210,359"
"С-ПЕТЕРБУРГСКИЙ ПР.,УГ. РАЗВОДНОЙ УЛ. [355]<";"С-ПЕТЕРБУРГСКИЙ ПР.,УГ. РАЗВОДНОЙ УЛ.";"Санкт-Петербургский проспект, Разводная улица";"59,88062362";"29,9041386";"Остановка";"356Б"
"СПОРТИВНО-КОНЦЕРТНЫЙ КОМПЛЕКС [72]<";"СПОРТИВНО-КОНЦЕРТНЫЙ КОМПЛЕКС";"Космонавтов пр.";"59,86939352";"30,3453121";"Остановка";"72"
"СПОРТКОМПЛЕКС";"СПОРТКОМПЛЕКС";"Тверская ул.";"59,73830859";"30,6108627";"Остановка";"192,326,367,392,544"
"СРЕДНЕОХТИНСКИЙ ПР. [22, 106]<";"СРЕДНЕОХТИНСКИЙ ПР.";"Революции ш., Среднеохтинский пр.";"59,95917602";"30,4164238";"Остановка";"22,37,106,174"
"СРЕДНИЙ ПР. [7]<";"СРЕДНИЙ ПР.";"Гаванская ул., Средний пр.";"59,93214905";"30,2401199";"Остановка";"1"
"СРЕДНИЙ ПР.,УГ. ГАВАНСКОЙ УЛ. [6]<";"СРЕДНИЙ ПР.,УГ. ГАВАНСКОЙ УЛ.";"Гаванская ул., Средний пр.";"59,93214905";"30,2401199";"Остановка";"3М,3МА,6,7,7А"
""СТ. МЕТРО "АВТОВО"";""СТ. МЕТРО "АВТОВО"";"Кронштадтская улица, дорога на Турухтанные Острова";"59,86883123";"30,257391";"Остановка";"66"
""СТ. МЕТРО "АКАДЕМИЧЕСКАЯ" [40, 93, 178]<"";""СТ. МЕТРО "АКАДЕМИЧЕСКАЯ"";"Гражданский пр., Науки пр.";"60,01283959";"30,3973675";"Остановка";"40,60,61"
""СТ. МЕТРО "АКАДЕМИЧЕСКАЯ" "";""СТ. МЕТРО "АКАДЕМИЧЕСКАЯ"";"Науки пр., Гражданский пр.";"60,01269963";"30,3986244";"Остановка";"102,103,153,176,177,178"
""СТ. МЕТРО "ВАСИЛЕОСТРОВСКАЯ"";""СТ. МЕТРО "ВАСИЛЕОСТРОВСКАЯ"";"Средний проспект, 4-5-я линии";"59,94349478";"30,2802105";"КП";"1,3М,3МА,6,24,24А,128"
""СТ. МЕТРО "ГОРЬКОВСКАЯ" [46А]<"";""СТ. МЕТРО "ГОРЬКОВСКАЯ"";"Каменноостровский пр., Кронверкский пр.";"59,95553426";"30,3216171";"Остановка";"2М,2МБ,46,46А"
""СТ. МЕТРО "ГОСТИНЫЙ ДВОР" [3, 7, 22, 24, 27]<"";""СТ. МЕТРО "ГОСТИНЫЙ ДВОР"";"Невский пр., пл. Островского";"59,93389427";"30,3387852";"Остановка";"3,3М,3МБ,7,7А,22,24,24А,27,135,135А,191,191А"
""СТ. МЕТРО "ГРАЖДАНСКИЙ ПР."";""СТ. МЕТРО "ГРАЖДАНСКИЙ ПР."";"Просвещения пр., Гражданский пр.";"60,0357244";"30,4179745";"Остановка";"1М,121,139"
""СТ. МЕТРО "ЕЛИЗАРОВСКАЯ"";""СТ. МЕТРО "ЕЛИЗАРОВСКАЯ"";"Бабушкина ул., Елизарова пр.";"59,89580016";"30,4240875";"Остановка";"3М,3МБ,116"
""СТ. МЕТРО "ЗВЕЗДНАЯ" "";""СТ. МЕТРО "ЗВЕЗДНАЯ"";"Ленсовета ул., Звездная ул.";"59,83249194";"30,3494129";"Остановка";"2М,2МА,34,50,64,64А,116,179,186,190,192,197"
""СТ. МЕТРО "КИРОВСКИЙ ЗАВОД"";""СТ. МЕТРО "КИРОВСКИЙ ЗАВОД"";"Стачек пр., Новостроек ул.";"59,87888588";"30,2603722";"Остановка";"1М,1МБ,2,66,72"
""СТ. МЕТРО "КОМЕНДАНТСКИЙ ПРОСПЕКТ"";""СТ. МЕТРО "КОМЕНДАНТСКИЙ ПРОСПЕКТ"";"Гаккелевская ул., Ильюшина ул.";"60,00650644";"30,258173";"Остановка";"5М,5МА,125,172"
""СТ. МЕТРО "КОМЕНДАНТСКИЙ ПРОСПЕКТ" "";""СТ. МЕТРО "КОМЕНДАНТСКИЙ ПРОСПЕКТ"";"Комендантский пр., Ильюшина ул.";"60,00882476";"30,2578678";"Остановка";"127"
""СТ. МЕТРО "КУПЧИНО" "";""СТ. МЕТРО "КУПЧИНО"";"Балканская площадь, ул. Ярослава Гашека";"59,8295743";"30,3810196";"Остановка";"2М,2МА,50,53,54,56,74,96,157,159,326"
""СТ. МЕТРО "ЛЕНИНСКИЙ ПР." [114, 130, 142]<"";""СТ. МЕТРО "ЛЕНИНСКИЙ ПР."";"Ленинский пр., Новаторов бул.";"59,85168025";"30,2699604";"Остановка";"26,73,114,130"
""СТ. МЕТРО "ЛЕСНАЯ" [33, 137]<"";""СТ. МЕТРО "ЛЕСНАЯ"";"Кантемировская ул., Парголовская ул.";"59,98511158";"30,3443069";"Остановка";"33,60,137,185"
""СТ. МЕТРО "ЛИГОВСКИЙ ПР." [15, 65, 74, 3]<"";""СТ. МЕТРО "ЛИГОВСКИЙ ПР."";"Лиговский пр., Транспортный пер.";"59,92161074";"30,3545837";"Остановка";"3,4МБ,26,54,65,74,76,91,141"
""СТ. МЕТРО "ЛОМОНОСОВСКАЯ" "";""СТ. МЕТРО "ЛОМОНОСОВСКАЯ"";"Бабушкина ул., Полярников ул.";"59,87820035";"30,4412689";"Остановка";"3М,3МБ,8,95,97,118,118А,119"
""СТ. МЕТРО "МОСКОВСКАЯ"";""СТ. МЕТРО "МОСКОВСКАЯ"";"ул. Типанова, Демонстрационный проезд";"59,8534743";"30,3237114";"Остановка";"2М,2МА,31,39,59,114,141,150,156"
""СТ. МЕТРО "НЕВСКИЙ ПР."";""СТ. МЕТРО "НЕВСКИЙ ПР."";"Невский пр., Малая Конюшенная ул.";"59,93536908";"30,3248386";"Остановка";"3,3М,3МБ,4М,4МБ,5М,5МБ,7,7А,22,24,24А,27,135,135А,191,191А"
""СТ. МЕТРО "НОВОЧЕРКАССКАЯ"";""СТ. МЕТРО "НОВОЧЕРКАССКАЯ"";"Новочеркасский пр., Заневский пр.";"59,93021893";"30,4112167";"Остановка";"5,132,174"
""СТ. МЕТРО "ОЗЕРКИ"";""СТ. МЕТРО "ОЗЕРКИ"";"Энгельса пр., Выборгское ш.";"60,03658407";"30,3224754";"Остановка";"2М,2МБ,80,85,86,109,109А,123"
""СТ. МЕТРО "ПАРК ПОБЕДЫ" [50, 3, Э, 39, 72]<"";""СТ. МЕТРО "ПАРК ПОБЕДЫ"";"Московский пр., Бассейная ул.";"59,86565617";"30,3202686";"Остановка";"2М,2МА,3,26,50"
""СТ. МЕТРО "ПЕТРОГРАДСКАЯ" [1, 46А]<"";""СТ. МЕТРО "ПЕТРОГРАДСКАЯ"";"Каменноостровский пр., Льва Толстого пл.";"59,96658142";"30,3106556";"Остановка";"1,2М,2МБ,10,10А,25,46,46А,180,191,191А"
""СТ. МЕТРО "ПИОНЕРСКАЯ" "";""СТ. МЕТРО "ПИОНЕРСКАЯ"";"Коломяжский пр., Испытателей пр.";"60,00194446";"30,2978764";"Остановка";"2М,2МБ,79,93,122,170,172"
""СТ. МЕТРО "ПЛОЩАДЬ АЛ. НЕВСКОГО"";""СТ. МЕТРО "ПЛОЩАДЬ АЛ. НЕВСКОГО"";"Невский пр., Чернорецкий пер.";"59,92413695";"30,3840733";"Остановка";"4М,4МБ,24,24А,27,46,55,191,191А"
""СТ. МЕТРО "ПЛОЩАДЬ ВОССТАНИЯ"";""СТ. МЕТРО "ПЛОЩАДЬ ВОССТАНИЯ"";"Невский пр., Пушкинская ул.";"59,93135853";"30,357111";"Остановка";"3,3М,3МБ,7,7А,24,24А,27,135,135А,181,191,191А"
""СТ. МЕТРО "ПЛОЩАДЬ МУЖЕСТВА" ПОСАДКА"";""СТ. МЕТРО "ПЛОЩАДЬ МУЖЕСТВА" ПОСАДКА"";"Непокоренных пр., пл. Мужества";"59,99785999";"30,3659763";"Остановка";"40,80,123,138"
""СТ. МЕТРО "ПР. БОЛЬШЕВИКОВ" [118, 140]<"";""СТ. МЕТРО "ПР. БОЛЬШЕВИКОВ"";"Коллонтай ул., Большевиков пр.";"59,91978955";"30,4715309";"Остановка";"4М,4МА,12,118,118А,140,161,164"
""СТ. МЕТРО "ПР. ПРОСВЕЩЕНИЯ" [143, 555, 435]<"";""СТ. МЕТРО "ПР. ПРОСВЕЩЕНИЯ"";"Хошимина ул., Просвещения пр.";"60,05298502";"30,3294525";"Остановка";"75,148,173,435,436,555,567"
""СТ. МЕТРО "ПРИМОРСКАЯ" [7]<"";""СТ. МЕТРО "ПРИМОРСКАЯ"";"Новосмоленская наб., Наличная ул.";"59,94861209";"30,2307281";"Остановка";"7,7А,47,152"
""СТ. МЕТРО "ПРИМОРСКАЯ"";""СТ. МЕТРО "ПРИМОРСКАЯ"";"Наличная ул., Одоевского ул.";"59,94882416";"30,2323742";"Остановка";"1,3М,3МА,6,41,100,158"
""СТ. МЕТРО "ПРОЛЕТАРСКАЯ" [11, 48, 115, 115, А]<"";""СТ. МЕТРО "ПРОЛЕТАРСКАЯ"";"Чернова ул., Обуховской обороны пр.";"59,86351987";"30,4692554";"Остановка";"51,53,97,115,115А,117,189,327"
""СТ. МЕТРО "ПУШКИНСКАЯ" [Э, 39]<"";""СТ. МЕТРО "ПУШКИНСКАЯ"";"Загородный пр., Винокурцевский проезд";"59,92026197";"30,3280888";"Остановка";"1М,1МБ,4М,4МБ,5М,5МБ"
""СТ. МЕТРО "РЫБАЦКОЕ" "";""СТ. МЕТРО "РЫБАЦКОЕ"";"Тепловозная ул., Прибрежная ул.";"59,83201484";"30,5018864";"Остановка";"51,115,115А,189,327"
""СТ. МЕТРО "СЕННАЯ ПЛОЩАДЬ" [49]<"";""СТ. МЕТРО "СЕННАЯ ПЛОЩАДЬ"";"Садовая ул., Спасский пер.";"59,92786773";"30,3211327";"Остановка";"2М,2МА,4М,4МБ,5М,5МБ,49,181"
""СТ. МЕТРО "СПОРТИВНАЯ" [1]<"";""СТ. МЕТРО "СПОРТИВНАЯ"";"Большой пр. П.С., Ждановская наб.";"59,95150562";"30,2887058";"Остановка";"1,128"
""СТ. МЕТРО "ТЕХНОЛОГИЧЕСКИЙ ИНСТИТУТ" [Э, 39, 70, 71]<"";""СТ. МЕТРО "ТЕХНОЛОГИЧЕСКИЙ ИНСТИТУТ"";"Московский пр., Загородный пр.";"59,91761564";"30,3182163";"Остановка";"71"
""СТ. МЕТРО "УЛ.ДЫБЕНКО"";""СТ. МЕТРО "УЛ.ДЫБЕНКО"";"Большевиков пр., Дыбенко ул.";"59,90622338";"30,48279";"Остановка";"4,97,140,467"
""СТ. МЕТРО "ФРУНЗЕНСКАЯ" [Э, 39]<"";""СТ. МЕТРО "ФРУНЗЕНСКАЯ"";"Московский пр., Смоленская ул.";"59,90557609";"30,3180962";"Остановка";"2М,2МА"
""СТ. МЕТРО "ЧЁРНАЯ РЕЧКА"";""СТ. МЕТРО "ЧЁРНАЯ РЕЧКА"";"Торжковская ул., Чёрной речки наб.";"59,98692234";"30,3038006";"Остановка";"1,46А,79,94,122"
""СТ. МЕТРО "ЧЕРНЫШЕВСКАЯ" "";""СТ. МЕТРО "ЧЕРНЫШЕВСКАЯ"";"Кирочная ул., Мелитопольский пер.";"59,94375819";"30,3616257";"Остановка";"22,46,105"
""СТ. МЕТРО "ЭЛЕКТРОСИЛА"";""СТ. МЕТРО "ЭЛЕКТРОСИЛА"";"Московский пр., Мариинская ул.";"59,88110346";"30,3194942";"Остановка";"12,29,95,159"
""СТ. МЕТРО "ЭЛЕКТРОСИЛА" [3, 50]<"";""СТ. МЕТРО "ЭЛЕКТРОСИЛА"";"Московский пр., Мариинская ул.";"59,87950627";"30,3194294";"Остановка";"2М,2МА,3,26,50,62,64,64А"
"СТАРОДЕРЕВЕНСКАЯ УЛ. [93, 154]<";"СТАРОДЕРЕВЕНСКАЯ УЛ.";"Савушкина ул., Стародеревенская улица";"59,98430183";"30,2436981";"Остановка";"32,93,110,120,211,216"
"СТАРОДЕРЕВЕНСКАЯ УЛ. УГ. УЛ. ИЛЬЮШИНА [134, 172]<";"СТАРОДЕРЕВЕНСКАЯ УЛ. УГ. УЛ. ИЛЬЮШИНА";"Ильюшина ул., Стародеревенская ул.";"60,00798486";"30,2496204";"Остановка";"125,134А,172"
"СТАРООБРЯДЧЕСКИЙ МОСТ";"СТАРООБРЯДЧЕСКИЙ МОСТ";"Расстанный пер., Реки Волковки наб";"59,90485344";"30,3630085";"Остановка";"5М,5МБ,74,91,141"
"СТАРО-ПЕТЕРГОФСКИЙ ПР. [65, 70, 70, 71, 49]<";"СТАРО-ПЕТЕРГОФСКИЙ ПР.";"Обводного канала наб., Старо-Петергофский пр.";"59,90891172";"30,2778397";"Остановка";"70"
"СТАРО-ПЕТЕРГОФСКИЙ ПР.,27 [2, 6, 66]<";"СТАРО-ПЕТЕРГОФСКИЙ ПР.,27";"Старо-Петергофский пр., Обводного канала наб.";"59,90748367";"30,2753868";"Остановка";"1М,1МБ,2,6,35,66"
"СТАХАНОВСКАЯ УЛ.";"СТАХАНОВСКАЯ УЛ.";"ул. Володарского, Стахановская ул.";"59,74405981";"30,5944557";"Остановка";"196,327,332,361,374,390"
"СТУДЕНЧЕСКАЯ УЛ. [33]<";"СТУДЕНЧЕСКАЯ УЛ.";"Ланское ш., Ланская ул.";"59,99664753";"30,3236027";"Остановка";"94,98"
"СУВОРОВСКАЯ ПЛОЩАДЬ [49]<";"СУВОРОВСКАЯ ПЛОЩАДЬ";"Миллионная ул., Лебяжьего канала наб.";"59,94564305";"30,3316174";"Остановка";"2М,2МА,46,49"
"СУВОРОВСКИЙ ПР. [24, 27, 15]<";"СУВОРОВСКИЙ ПР.";"Невский пр., Суворовский пр.";"59,92999306";"30,3672943";"Остановка";"3М,3МБ,4М,4МБ,24,24А,27,191,191А"
"СУВОРОВСКИЙ ПР. УГ. ТУЛЬСКОЙ УЛ. [136, 22]<";"СУВОРОВСКИЙ ПР. УГ. ТУЛЬСКОЙ УЛ.";"Тульская ул., Ярославская ул.";"59,9442508";"30,3879452";"Остановка";"22,105,136,181"
""СУПЕРМАРКЕТ "О' КЕЙ" [13, 13А, 39, 90, 187]<"";""СУПЕРМАРКЕТ "О' КЕЙ"";"Пулковское ш.";"59,82779956";"30,3231163";"Остановка";"13,13А,39,90,155,187"
""ГИПЕРМАРКЕТ "ЛЕНТА"";""ГИПЕРМАРКЕТ "ЛЕНТА"";"Савушкина ул., Приморское ш.";"59,98550107";"30,2265339";"Остановка";"32,93,101,101А,110,120,134А,170,211,216"
"РАБОЧАЯ УЛ. [20, 145, 165]<";"РАБОЧАЯ УЛ.";"Таллиннское ш.";"59,81362228";"30,1732655";"Остановка";"20,81,108,145,145А,165,195"
"ТВЕРСКАЯ УЛ.,УГ.УЛ.ИЖОРСКОГО БАТАЛЬОНА";"ТВЕРСКАЯ УЛ.,УГ.УЛ.ИЖОРСКОГО БАТАЛЬОНА";"ул. Ижорского батальона, ул. Тверская";"59,73539303";"30,6122227";"Остановка";"192,326,368,386"
"ТЕАТР ЗА ЧЁРНОЙ РЕЧКОЙ [93, 172]<";"ТЕАТР ЗА ЧЁРНОЙ РЕЧКОЙ";"Богатырский пр.";"59,99969397";"30,2908001";"Остановка";"93,170,172"
"ТЕЛЕЗИ [482, 482а, 482в, 484, 484б]<";"ТЕЛЕЗИ";"Таллинское ш.";"59,70086539";"29,9757786";"Остановка";"481,482,482А,482В,484,484Б,547"
"ТЕШКОВО [487, 487, 487а]<";"ТЕШКОВО";"Таллинское ш.";"59,58971551";"29,4158764";"Остановка";"487"
""ТК "ЛЕНТА"";""ТК "ЛЕНТА"";"Железнодорожная улица";"59,80262377";"30,3954582";"Остановка";"179,192,196"
"ТОВАРИЩЕСКИЙ ПР. [12, 118, 140]<";"ТОВАРИЩЕСКИЙ ПР.";"Коллонтай ул., Товарищеский пр.";"59,92172712";"30,4797268";"Остановка";"12,118А,140,164"
""ТОРГОВЫЙ КОМПЛЕКС "ЛЕНТА" [13, 13А]<"";""ТОРГОВЫЙ КОМПЛЕКС "ЛЕНТА"";"Стартовая ул., Шереметьевская ул.";"59,81011565";"30,3184185";"Остановка";"13,13А"
"ТОРГОВЫЙ ЦЕНТР [123, 136]<";"ТОРГОВЫЙ ЦЕНТР";"Энергетиков пр., Большая Пороховская ул.";"59,95512047";"30,4375839";"Остановка";"82,123,136"
""ТОРГОВЫЙ ЦЕНТР "МЕТРО" [13, 13А, 39, 90, 187]<"";""ТОРГОВЫЙ ЦЕНТР "МЕТРО"";"Пулковское ш.";"59,82378631";"30,3233452";"Остановка";"13,13А,39,90,150,155,187"
"ТОРФЯНАЯ УЛ. [398]<";"ТОРФЯНАЯ УЛ.";"1-го Мая ул., Торфяная ул.";"60,07847574";"30,2466393";"Остановка";"397,398"
"ТРАМВАЙНЫЙ ПР. [20, 200, 210, 145, 482, 482а, 482в, 484, 484б, 229]<";"ТРАМВАЙНЫЙ ПР.";"Стачек пр., Трамвайный пр.";"59,85921597";"30,2546482";"Остановка";"1М,1МБ,2А,18,20,26,73,83,108,145,145А,160,200,210,229,300,481,482,482А,482В,484,484Б,487"
""ТРЦ "ПУЛКОВО-III" [39, 90, 187]<"";""ТРЦ "ПУЛКОВО-III"";"Пулковское ш., Внуковская ул.";"59,80430367";"30,3244934";"Остановка";"39,90,150,155,187"
"ТУРИСТСКАЯ УЛ. ПО УЛ. САВУШКИНА [134]<";"ТУРИСТСКАЯ УЛ. ПО УЛ. САВУШКИНА";"Савушкина ул., Туристская ул.";"59,98841871";"30,2039433";"Остановка";"101,101А,110,120,134А,134Ш,211,216"
"УЛ. 2-Й ЛУЧ [58]<";"УЛ. 2-Й ЛУЧ";"2-й луч ул., Фаянсовая ул.";"59,91134644";"30,3972931";"Остановка";"58"
"УЛ. АВАНГАРДНАЯ [229]<";"УЛ. АВАНГАРДНАЯ";"проспект Ветеранов, Авангардная улица";"59,8331029";"30,1817074";"Остановка";"229"
"УЛ. АВРОВА,УГ. С-ПЕТЕРБУРГС. ПР. [351, 356, 356Б, 355]<";"УЛ. АВРОВА,УГ. С-ПЕТЕРБУРГС. ПР.";"Санкт-Петербургское ш., Аврова ул.";"59,87777875";"29,924015";"Остановка";"278"
"УЛ. АКАДЕМИКА БАЙКОВА [69, 98, 143]<";"УЛ. АКАДЕМИКА БАЙКОВА";"Светлановский пр., Академика Байкова ул.";"60,02490848";"30,3823452";"Остановка";"69,98"
"УЛ. АКАДЕМИКА ПАВЛОВА [1, 46А]<";"УЛ. АКАДЕМИКА ПАВЛОВА";"Каменноостровский пр., Академика Павлова ул.";"59,97614512";"30,3025684";"Остановка";"1,2М,2МБ,5М,5МА,46,46А,180"
"УЛ. АЛ. МАТРОСОВА [86]<";"УЛ. АЛ. МАТРОСОВА";"Большой Сампсониевский пр., Александра Матросова ул.";"59,9791456";"30,3372726";"Остановка";"86"
"УЛ. АНТОНОВА - ОВСЕЕНКО [118, 140, 12]<";"УЛ. АНТОНОВА - ОВСЕЕНКО";"Искровский пр., Антонова-Овсеенко ул.";"59,90799051";"30,4649124";"Остановка";"12,118,118А"
"УЛ. АСАФЬЕВА [86, 123]<";"УЛ. АСАФЬЕВА";"Композиторов ул., Асафьева ул.";"60,04823166";"30,318243";"Остановка";"80,86,123"
"УЛ. Б. КУНА,УГ. ПРАЖСКОЙ УЛ. [116]<";"УЛ. Б. КУНА,УГ. ПРАЖСКОЙ УЛ.";"Пражская ул., Белы Куна ул.";"59,87401834";"30,3889332";"Остановка";"57,116"
"УЛ. БАБУШКИНА [8, 12, 140]<";"УЛ. БАБУШКИНА";"Ивановская ул., Прямой пр.";"59,87589689";"30,446579";"Остановка";"8"
"УЛ. БАБУШКИНА,УГ. БУЛЬВАРА КРАСНЫХ ЗОРЬ [95]<";"УЛ. БАБУШКИНА,УГ. БУЛЬВАРА КРАСНЫХ ЗОРЬ";"Красных Зорь бул., Седова ул.";"59,87067921";"30,4407768";"Остановка";"97"
"УЛ. БАБУШКИНА,УГ. УЛ. ИВАНОВСКАЯ [119]<";"УЛ. БАБУШКИНА,УГ. УЛ. ИВАНОВСКАЯ";"Ивановская ул., Прямой пр.";"59,87589689";"30,446579";"Остановка";"5,12,97,118,118А,119,140,476"
"УЛ. БАБУШКИНА,УГ. УЛ. ЧЕРНОВА [115, 115, А]<";"УЛ. БАБУШКИНА,УГ. УЛ. ЧЕРНОВА";"Бабушкина ул., Грибакиных ул.";"59,86069068";"30,4687023";"Остановка";"51,189,327"
"УЛ. БАДАЕВА [12]<";"УЛ. БАДАЕВА";"Бадаева ул., Коллонтай ул.";"59,91686244";"30,4557495";"Остановка";"12"
