Наименование остановки;Официальное наименование;Расположение;Широта;Долгота;Тип объекта;Маршруты
"УЛ. МАРШАЛА ЗАХАРОВА,УГ. УЛ. ДЕСАНТНИКОВ [142]";"УЛ. МАРШАЛА ЗАХАРОВА,УГ. УЛ. ДЕСАНТНИКОВ";"Десантников ул., Маршала Захарова ул.";"59,8518552";"30,1985645";"Остановка";"111,142,300"
"УЛ. МАРШАЛА КАЗАКОВА [2]";"УЛ. МАРШАЛА КАЗАКОВА";"Маршала Жукова пр., Маршала Казакова ул.";"59,86003564";"30,2341156";"Остановка";"2,111"
"УЛ. МАРШАЛА НОВИКОВА [9, 85, 127, 171, 134]";"УЛ. МАРШАЛА НОВИКОВА";"Автобусная ул., Маршала Новикова ул.";"60,02763497";"30,2742367";"Остановка";"9,40,127,171"
"УЛ. МАРШАЛА ТУХАЧЕВСКОГО [132, 133]";"УЛ. МАРШАЛА ТУХАЧЕВСКОГО";"Пискаревский пр., Маршала Тухачевского ул.";"59,973763";"30,4146175";"Остановка";"132,133"
"УЛ. МАССАЛЬСКОГО [145, 165, 482, 484, 482а, 482в, 484б, 487, 487]";"УЛ. МАССАЛЬСКОГО";"Таллинское ш., Массальского ул.";"59,73858051";"30,0900154";"Остановка";"145,145А,147,149,149А,165,442,458,458Б,481,482,482А,482В,484,484Б,487"
"ШКОЛА [123]";"ШКОЛА";"Сикейроса ул.";"60,03548902";"30,3383064";"Остановка";"80,123"
"ШКОЛА";"ШКОЛА";"Морская улица, улица Жоры Антоненко";"59,90240454";"29,8173313";"Остановка";"200,348,349,682,683,683А,684,686,687"
""МУЗЕЙ "ДВОРЦОВАЯ ТЕЛЕГРАФНАЯ СТАНЦИЯ"";""МУЗЕЙ "ДВОРЦОВАЯ ТЕЛЕГРАФНАЯ СТАНЦИЯ"";"Санкт-Петербургский пр., ул. Зверинская";"59,87736399";"29,9289303";"Остановка";"200,210,278,348,357А,359"
"ШКОЛЬНАЯ УЛ. [187]";"ШКОЛЬНАЯ УЛ.";"Октябрьский бул., Школьная ул.";"59,72620406";"30,4026756";"Остановка";"187"
"ШКОЛЬНАЯ УЛ. ПОЛИКЛИНИКА [186]";"ШКОЛЬНАЯ УЛ. ПОЛИКЛИНИКА";"Школьная ул., Алексея Толстого бул.";"59,73269754";"30,4088631";"Остановка";"186,376,377,381"
"ШКОЛЬНАЯ УЛ. УГОЛ УЛ. ХАЗОВА [186]";"ШКОЛЬНАЯ УЛ. УГОЛ УЛ. ХАЗОВА";"Школьная ул., Генерала Хазова ул.";"59,73772688";"30,4120827";"Остановка";"186,377"
"ШЛИССЕЛЬБУРГСКИЙ ПР.,1 [115, 115, А]";"ШЛИССЕЛЬБУРГСКИЙ ПР.,1";"Шлиссельбургский пр., Караваевская ул.";"59,84167571";"30,4886532";"Остановка";"3М,3МБ,51,115,115А,189,327"
"ШЛИССЕЛЬБУРГСКИЙ ПР.,43 [115, 115, А]";"ШЛИССЕЛЬБУРГСКИЙ ПР.,43";"Шлиссельбургский пр., ул. Веры Фигнер";"59,83267043";"30,5179958";"Остановка";"115,115А,189,327"
"ШЛИССЕЛЬБУРГСКИЙ ПР.,УГ. ПРИБРЕЖНОЙ УЛ. [115, 115, А]";"ШЛИССЕЛЬБУРГСКИЙ ПР.,УГ. ПРИБРЕЖНОЙ УЛ.";"Шлиссельбургский пр., ул. Прибрежная";"59,83543336";"30,5094795";"Остановка";"115,115А,189,327"
"ШЛИССЕЛЬбУРГСКИЙ ПР.,УНИВЕРСАМ [115, 115, А]";"ШЛИССЕЛЬБУРГСКИЙ ПР.,УНИВЕРСАМ";"Шлиссельбургский пр.";"59,8397918";"30,4954052";"Остановка";"3М,3МБ,51,115,115А,189,327"
"ШЛИССЕЛЬБУРГСКИЙ ПР.,ШКОЛА [115, 115, А]";"ШЛИССЕЛЬБУРГСКИЙ ПР.,ШКОЛА";"Шлиссельбургский пр., ул. Веры Фигнер";"59,83368296";"30,5149021";"Остановка";"115,115А,189,327"
"ШОССЕ РЕВОЛЮЦИИ [22, 123, 136]";"ШОССЕ РЕВОЛЮЦИИ";"Революции ш., Энергетиков пр.";"59,96025992";"30,4361153";"Остановка";"22,28,37,106,174,183"
"ШОССЕ РЕВОЛЮЦИИ [132]";"ШОССЕ РЕВОЛЮЦИИ";"Металлистов пр., Революции ш.";"59,95997613";"30,4226131";"Остановка";"28,132,183"
"ШОССЕ РЕВОЛЮЦИИ";"ШОССЕ РЕВОЛЮЦИИ";"улица Коммуны, шоссе Революции";"59,9674463";"30,4830017";"Остановка";"37,102,103,153,168"
"ШОССЕ РЕВОЛЮЦИИ,116 [153, 102, 103]";"ШОССЕ РЕВОЛЮЦИИ,116";"Революции ш., ш. Революции";"59,965402";"30,4749317";"Остановка";"37,102,103,153,168"
"ШОССЕ РЕВОЛЮЦИИ,88 [153, 102, 103]";"ШОССЕ РЕВОЛЮЦИИ,88";"Революции ш., Потапова ул.";"59,96268063";"30,4640236";"Остановка";"28,37,102,103"
"ШОССЕ РЕВОЛЮЦИИ,УГ. ИНДУСТРИАЛЬНОГО ПР. [174]";"ШОССЕ РЕВОЛЮЦИИ,УГ. ИНДУСТРИАЛЬНОГО ПР.";"Индустриальный пр., Революции ш.";"59,9616686";"30,4604759";"Остановка";"19,153,174"
"ШПАЛЕРНАЯ УЛ. УГ. ПОТЁМКИНСКОЙ УЛ. [136]";"ШПАЛЕРНАЯ УЛ. УГ. ПОТЁМКИНСКОЙ УЛ.";"Шпалерная ул., Потемкинская ул.";"59,94872839";"30,369173";"Остановка";"46,136"
"ШУВАЛОВКА,УЛ. МАКАРОВА [210, 359, 200]";"ШУВАЛОВКА,УЛ. МАКАРОВА";"Санкт-Петербургское шоссе, улица Макарова";"59,86821408";"29,9763107";"Остановка";"200,210,359"
"ШУВАЛОВСКИЙ ПАРК [435, 555]";"ШУВАЛОВСКИЙ ПАРК";"Выборгское ш., Заречная ул.";"60,06799759";"30,2959538";"Остановка";"75,104,109,109А,173,397,433,435,436,555,567"
"ШУВАЛОВСКОЕ КЛАДБИЩЕ [435, 555]";"ШУВАЛОВСКОЕ КЛАДБИЩЕ";"Выборгское ш., Петровская ул.";"60,05409995";"30,309433";"Остановка";"75,104,109,109А,167,173,397,433,435,436,555,567"
"ШУНДОРОВО [482, 482в, 487, 487, 487а]";"ШУНДОРОВО";"Таллинское ш.";"59,63738295";"29,6028709";"Остановка";"482,482В,487"
"ЭРЛЕРОВСКИЙ БУЛЬВАР [351]";"ЭРЛЕРОВСКИЙ БУЛЬВАР";"Аврова ул.";"59,87050779";"29,9193058";"Остановка";"278,350,351,352,357А"
"ЭРЛЕРОВСКИЙ БУЛЬВАР ПО УЛ. АВРОВА [355]";"ЭРЛЕРОВСКИЙ БУЛЬВАР ПО УЛ. АВРОВА";"улица Аврова, Эрлеровский бульвар";"59,87026094";"29,9190216";"Остановка";"344,356"
"ЭРЛЕРОВСКИЙ БУЛЬВАР,УГ. УЛ. АВРОВА [356Б, 356, 355]";"ЭРЛЕРОВСКИЙ БУЛЬВАР,УГ. УЛ. АВРОВА";"Аврова ул.";"59,8707375";"29,917469";"Остановка";"354,355"
"ЯКОРНАЯ УЛ. [123]";"ЯКОРНАЯ УЛ.";"Энергетиков пр., Якорная ул.";"59,94287559";"30,4351482";"Остановка";"82,123"
"ЯКОРНАЯ УЛ. УГ. ПР. МЕТАЛЛИСТОВ [132]";"ЯКОРНАЯ УЛ. УГ. ПР. МЕТАЛЛИСТОВ";"Металлистов пр., Якорная ул.";"59,94370346";"30,4200211";"Остановка";"132"
"ЯХТЕННАЯ УЛ. [154, 172]";"ЯХТЕННАЯ УЛ.";"Камышовая ул., Яхтенная ул.";"60,00880768";"30,2254009";"Остановка";"166,172"
"ЯХТЕННАЯ УЛ. УГ. ШКОЛЬНОЙ УЛ. [93, 134]";"ЯХТЕННАЯ УЛ. УГ. ШКОЛЬНОЙ УЛ.";"Школьная ул., Яхтенная ул.";"59,99149665";"30,2166557";"Остановка";"32,93,170"
"1 ЛИНИЯ, УГ. БОЛЬШОГО ПР. В.О. [7]<";"1 ЛИНИЯ, УГ. БОЛЬШОГО ПР. В.О.";"1-я и Кадетская линии, Большой ВО Проспект";"59,94093241";"30,2915783";"Остановка";"7,24,24А,47"
"10 И 11 ЛИНИИ ПО НАБ. Л. ШМИДТА [1]<";"10 И 11 ЛИНИИ ПО НАБ. Л. ШМИДТА";"Лейтенанта Шмидта наб., 10-11-я линии";"59,93495163";"30,2800903";"Остановка";"1"
"10 КМ [145, 165, 482, 482а, 482в, 484, 484б]<";"10 КМ";"Таллинское ш.";"59,77401825";"30,1262436";"Остановка";"145,145А,147,165,442,458,458Б,481,482,482А,482В,484,484Б"
"10 КМ (ОБРАТНО ПО ТРЕБОВАНИЮ) [435]<";"10 КМ";"H-89";"60,19616743";"30,147728";"Остановка";"435"
"14 И 15 ЛИНИИ ПО НАБ. Л. ШМИДТА [1]<";"14 И 15 ЛИНИИ ПО НАБ. Л. ШМИДТА";"Лейтенанта Шмидта наб., 14-15-я линии";"59,93328174";"30,2757492";"Остановка";"1"
"18-19 ЛИНИИ [6]<";"18-19 ЛИНИИ";"Средний пр., 18-19-я линии";"59,93869487";"30,2630787";"Остановка";"3М,3МА,6"
"1-Й МУРИНСКИЙ ПР. [86]<";"1-Й МУРИНСКИЙ ПР.";"Большой Сампсониевский пр., 1-й Муринский пр.";"59,98803267";"30,3335571";"Остановка";"86"
"1-Я И КАДЕТСКАЯ ЛИНИИ,УГ. УНИВЕРСИТЕТСКОЙ НАБ. [24]<";"1-Я И КАДЕТСКАЯ ЛИНИИ,УГ. УНИВЕРСИТЕТСКОЙ НАБ.";"1-я и Кадетская линии, Румянцевская пл.";"59,93875304";"30,2935791";"Остановка";"3МА"
"1-Я И КАДЕТСКАЯ ЛИНИЯ,УГ. СРЕДНЕГО ПР. [6]<";"1-Я И КАДЕТСКАЯ ЛИНИЯ,УГ. СРЕДНЕГО ПР.";"Средний проспект В.О., улица Репина";"59,94515731";"30,28512";"Остановка";"47"
"2 КМ [187]<";"2 КМ";"Петербургское ш.";"59,7686436";"30,3468895";"Остановка";"187"
"21 КМ [485]<";"21 КМ";"";"59,88389664";"30,6808891";"Остановка";"485"
"22-23 ЛИНИИ [6]<";"22-23 ЛИНИИ";"Средний пр., 22-23-я линии";"59,9371244";"30,2576046";"Остановка";"3М,3МА,6"
"25 КМ [435]<";"25 КМ";"A-122";"60,12272667";"30,2309666";"Остановка";"84,435,497"
"26 И 27 ЛИНИИ [1]<";"26 И 27 ЛИНИИ";"Большой пр. В.О., 26-27-я линии";"59,93124218";"30,2557888";"Остановка";"128"
"26 КМ [435]<";"26 КМ";"A-122, Молодцова ул.";"60,13929907";"30,2105865";"Остановка";"84,435,497"
"26-27 ЛИНИИ [7]<";"26-27 ЛИНИИ";"Большой пр. В.О., 26-27-я линии";"59,93124218";"30,2557888";"Остановка";"1,7,7А"
"28 КМ [482, 482а, 482в, 484, 484шК., 484б]<";"28 КМ";"Таллинское ш.";"59,68218324";"29,8932991";"Остановка";"481,482,482А,482В,484,484Б,547"
"28-29 ЛИНИИ (ПО СРЕДНЕМУ ПР. В.О.)";"28-29 ЛИНИИ (ПО СРЕДНЕМУ ПР. В.О.)";"Средний пр., 28-29-я линии";"59,9347908";"30,2504463";"Остановка";"3М,3МА,6"
"29 КМ [435]<";"29 КМ";"A-122";"60,15467346";"30,1912842";"Остановка";"435,497"
"ПОЛОЦКАЯ УЛ.";"ПОЛОЦКАЯ УЛ.";"";"59,7342467";"30,4717178";"Остановка";"179,325,374,375,375А"
"30 КМ [555, 435]<";"30 КМ";"A-122";"60,1645566";"30,1831112";"Остановка";"435,497,555"
"31 КМ [435]<";"31 КМ";"A-122";"60,17079491";"30,1799965";"Остановка";"435,497"
"36 КМ [555]<";"36 КМ";"A-122";"60,18897301";"30,0989666";"Остановка";"555"
"39 КМ,1 [555]<";"39 КМ,1";"A-122";"60,19582795";"30,0584736";"Остановка";"555"
"УЛ. МОИСЕЕНКО [15]";"УЛ. МОИСЕЕНКО";"Новгородская ул., Моисеенко ул.";"59,93718257";"30,3866482";"Остановка";"15,46,55"
"СТ.МЕТРО «УДЕЛЬНАЯ»";"СТ.МЕТРО «УДЕЛЬНАЯ»";"Скобелевский пр., Костромской пр.";"60,01799057";"30,3158283";"Остановка";"40,85"
"ФРОНТОВАЯ УЛ.";"ФРОНТОВАЯ УЛ., УГ. САНКТ-ПЕТЕРБУРГСКОГО ШОССЕ";"Фронтовая ул., Санкт-Петербургское ш.";"59,85248981";"30,0370178";"Остановка";"162,163"
"КУПЧИНСКАЯ УЛ., УГ. ДУНАЙСКОГО ПР. [тест]";"КУПЧИНСКАЯ УЛ., УГ. ДУНАЙСКОГО ПР.";"Дунайский пр., ул. Купчинская";"59,8368748";"30,3896332";"Остановка";"326"
"БУХАРЕСТСКАЯ УЛ. [тест]";"БУХАРЕСТСКАЯ УЛ.";"Дунайский пр., ул. Бухарестская";"59,84205316";"30,4083405";"Остановка";"53,326"
"БУХАРЕСТСКАЯ УЛ. [тест]<";"БУХАРЕСТСКАЯ УЛ.";"Дунайский пр., ул. Бухарестская";"59,84221101";"30,4104004";"Остановка";"53,326"
"ВОЛКОВИЦЫ [484] [тест]";"ВОЛКОВИЦЫ";"";"59,64887768";"29,8223648";"Остановка";"484"
"ВОЛКОВИЦЫ [484] [тест] <";"ВОЛКОВИЦЫ";"";"59,648536";"29,8225594";"Остановка";"484"
"ДОРОГА НА РУССКО-ВЫСОЦКУЮ ПТИЦЕФАБРИКУ [тест]";"ДОРОГА НА РУССКО-ВЫСОЦКУЮ ПТИЦЕФАБРИКУ";"Нарвское ш.";"59,69820503";"29,9638596";"Остановка";"484"
"ДОРОГА НА РУССКО-ВЫСОЦКУЮ ПТИЦЕФАБРИКУ [тест]<";"ДОРОГА НА РУССКО-ВЫСОЦКУЮ ПТИЦЕФАБРИКУ";"Нарвское ш.";"59,69880811";"29,9621525";"Остановка";"481,484,484Б,547"
"РУССКО-ВЫСОЦКОЕ, ПАМЯТНИК [тест]";"РУССКО-ВЫСОЦКОЕ, ПАМЯТНИК";"Нарвское ш.";"59,69388666";"29,9336758";"Остановка";"481,484,484Б,547"
"РУССКО-ВЫСОЦКОЕ, ПАМЯТНИК [тест]<";"РУССКО-ВЫСОЦКОЕ, ПАМЯТНИК";"Нарвское ш.";"59,69350408";"29,9326591";"Остановка";"481,484,484Б,547"
"КРАСНОСЕЛЬСКОЕ ШОССЕ, 65";"КРАСНОСЕЛЬСКОЕ ШОССЕ, 65";"";"59,70372884";"30,3596344";"Остановка";"186,188,273,372,376,380,380Э,381"
"СТРЕЛЬНА, Ж/Д СТ. [тест] <";"СТРЕЛЬНА, Ж/Д СТ.";"Фронтовая ул., Вокзальная ул.";"59,8460402";"30,03335";"Остановка";"162,163"
"УЛ. СВЯЗИ [тест]";"УЛ. СВЯЗИ";"улица Связи, улица Свободы";"59,84807471";"30,0085487";"Остановка";"162,163"
"БСХ, БЫТОВЫЕ ПРИБОРЫ";"БСХ, БЫТОВЫЕ ПРИБОРЫ";"ул. Связи, ул. Новые Заводы";"59,84043351";"29,9968796";"Остановка";"162,163"
"Средний пр.В.О.";"СРЕДНИЙ ПР.В.О.";"Наличная, Средний";"59,93160151";"30,2368011";"Остановка";"152"
"АЛЬПИЙСКИЙ ПЕР. [тест]";"АЛЬПИЙСКИЙ ПЕР.";"ул. Бухарестская, Южное ш.";"59,85548434";"30,3963737";"Остановка";"54,56,57"
"ШОССЕ РЕВОЛЮЦИИ [80, 123,136]";"ШОССЕ РЕВОЛЮЦИИ";"Энергетиков пр., Революции ш.";"59,95948376";"30,4376698";"Остановка";"82"
"Б. ПОРОХОВСКАЯ УЛ. [80, 123]";"Б. ПОРОХОВСКАЯ УЛ.";"Энергетиков пр., Большая Пороховская ул.";"59,95256584";"30,4366856";"Остановка";"82,123"
"НОВОСЕЛЬЕ 1 [тест]";"НОВОСЕЛЬЕ 1";"Красносельское ш.";"59,80644034";"30,0769405";"Остановка";"129,461,462,488"
"ВЛАДИМИРСКАЯ ПЛОЩАДЬ";"ВЛАДИМИРСКАЯ ПЛОЩАДЬ";"Загородный пр., Бол. Московская ул.";"59,9281518";"30,346859";"Остановка";"1М,1МБ"
"ПР.ВЕТЕРАНО";"ПР.ВЕТЕРАНОВ";"улица Пограничника Гарькавого, проспект Ветеранов";"59,83569419";"30,1467819";"Остановка";"229"
"ЗАГРЕБСКИЙ БУЛЬВАР [56] [тест]<";"ЗАГРЕБСКИЙ БУЛЬВАР";"Олеко Дундича ул., Загребcкий бульвар";"59,83162697";"30,4128819";"Остановка";"56,96"
"ЛЕРМОНТОВСКИЙ ПР. [70] [тест]";"ЛЕРМОНТОВСКИЙ ПР.";"Лермонтовский пр., Садовая ул.";"59,92007711";"30,2948532";"Остановка";"22,7"
"КРАСНОГОРОДСКАЯ УЛ., 17 [145А] [тест]";"КРАСНОГОРОДСКАЯ УЛ., 17";"Красногородская ул., Гатчинское ш.";"59,71775308";"30,0760937";"Остановка";"144,145А"
"НАРВСКАЯ УЛ., 10 [145А][тест]";"НАРВСКАЯ УЛ., 10";"Нарвская ул., Красногородская ул.";"59,71822493";"30,0708981";"Остановка";"144,145А"
"НАРВСКАЯ УЛ., 2 [145А][тест]";"НАРВСКАЯ УЛ., 2";"Нарвская ул., Кингисеппское ш.";"59,72072873";"30,0686131";"Остановка";"144,145А"
"СТ.МЕТРО «ЛЕНИНСКИЙ ПР.»";"СТ.МЕТРО «ЛЕНИНСКИЙ ПР.»";"Новаторов бул., Ленинский пр.";"59,85125144";"30,2674618";"Остановка";"18,18А,142"
"УЛ. ДОБЛЕСТИ";"УЛ. ДОБЛЕСТИ";"Доблести ул., Маршала Захарова ул.";"59,8567637";"30,1767082";"Остановка";"2А,111,142,160"
"УСТЬ-ИЖОРА, ПОЛЕВАЯ УЛИЦА[115, 115А][тест]";"УСТЬ-ИЖОРА, ПОЛЕВАЯ УЛИЦА";"Петрозаводское шоссе, улица Некрасова";"59,81591289";"30,5743408";"Остановка";"115,189"
"ДОРОГА НА МЕТАЛЛОСТРОЙ";"ДОРОГА НА МЕТАЛЛОСТРОЙ";"Центральная улица, Центральная ул.";"59,81303157";"30,5804195";"Остановка";"115,335,335А,337,337А"
"ДОРОГА НА МЕТАЛЛОСТРОЙ";"ДОРОГА НА МЕТАЛЛОСТРОЙ";"Петрозаводское шоссе, ул. Центральная";"59,81347117";"30,5806389";"Остановка";"115,115А,189,327"
"ПОС. МЕТАЛЛОСТРОЙ, 3А";"ПОС. МЕТАЛЛОСТРОЙ, 3А";"";"59,79019887";"30,568491";"Остановка";"115,335,337,396А"
"БУДАПЕШТСКАЯ УЛ.";"БУДАПЕШТСКАЯ УЛ.";"Димитрова ул., Будапештская ул.";"59,8483526";"30,3876476";"Остановка";"54,157"
"БУХАРЕСТСКАЯ УЛ. [][тест]";"БУХАРЕСТСКАЯ УЛ.";"Димитрова ул., Бухарестская ул.";"59,85150873";"30,4007797";"Остановка";"157"
"МАЛАЯ БУХАРЕСТСКАЯ УЛ. [][тест]";"МАЛАЯ БУХАРЕСТСКАЯ УЛ.";"ул. Димитрова, ул. Малая Бухарестская";"59,85162193";"30,4113998";"Остановка";"157"
"МАЛАЯ БУХАРЕСТСКАЯ УЛ. [][тест]<";"МАЛАЯ БУХАРЕСТСКАЯ УЛ.";"Димитрова ул., Малая Бухарестская ул.";"59,85209189";"30,4094906";"Остановка";"157"
"СОФИЙСКАЯ УЛ. [][тест]";"СОФИЙСКАЯ УЛ.";"пр. Александровской фермы, ул. Софийская";"59,85198555";"30,4275703";"Остановка";"53,117,157"
"СОФИЙСКАЯ УЛ. [][тест]<";"СОФИЙСКАЯ УЛ.";"ул. Димитрова, ул. Софийская";"59,85212276";"30,4243298";"Остановка";"157"
""КЛАДБИЩЕ "ПАМЯТИ ЖЕРТВ ДЕВЯТОГО ЯНВАРЯ"";""КЛАДБИЩЕ "ПАМЯТИ ЖЕРТВ ДЕВЯТОГО ЯНВАРЯ"";"Александровской фермы пр.";"59,8530661";"30,4386597";"Остановка";"53,117,157"
""КЛАДБИЩЕ "ПАМЯТИ ЖЕРТВ ДЕВЯТОГО ЯНВАРЯ"";""КЛАДБИЩЕ "ПАМЯТИ ЖЕРТВ ДЕВЯТОГО ЯНВАРЯ"";"Александровской фермы пр.";"59,85321703";"30,4385376";"Остановка";"53,117,157"
"УЛ. СЕДОВА [][тест]";"УЛ. СЕДОВА";"Седова ул., Александровской фермы пр.";"59,86146916";"30,4495945";"Остановка";"5,115,115А,157"
"УЛ. СЕДОВА [][тест]<";"УЛ. СЕДОВА";"Александровской фермы пр., Седова ул.";"59,86077984";"30,4504108";"Остановка";"53,117"
"ПОЛЕВАЯ УЛ., 22";"ПОЛЕВАЯ УЛ., 22";"ул. Полевая, ул. Хвойная";"59,8158339";"30,5686836";"Остановка";"115А"
"ОТДЕЛЕНИЕ «НОЙДОРФ»";"ОТДЕЛЕНИЕ «НОЙДОРФ»";"улица Связи, Охотничья улица";"59,84107177";"30,0029888";"Остановка";"162,163"
"ОХОТНИЧЬЯ УЛ.";"ОХОТНИЧЬЯ УЛ.";"Кирпичная улица, Охотничья улица";"59,84180267";"30,0083504";"Остановка";"162,163"
"БУЛЬВАР НОВАТОРОВ ПО ДАЧНОМУ ПР. [162][тест]";"БУЛЬВАР НОВАТОРОВ ПО ДАЧНОМУ ПР.";"Дачный пр., Новаторов бул.";"59,84221787";"30,2546234";"Остановка";"68,162"
"БАССЕЙНАЯ [][тест]";"БАССЕЙНАЯ";"Витебский пр., Бассейная ул.";"59,86499095";"30,3567047";"Остановка";"72"
"БАССЕЙНАЯ [][тест]<";"БАССЕЙНАЯ";"ул. Бассейная, Витебский пр.";"59,86517269";"30,3560696";"Остановка";"72"
"ЛЕОНТЬЕВСКАЯ УЛ. [187][тест]<";"ЛЕОНТЬЕВСКАЯ УЛ.";"Октябрьский бульвар, ул. Леонтьевская";"59,72404159";"30,4099522";"Остановка";"187"
"УНИВЕРСИТЕТСКИЙ ПР.";"УНИВЕРСИТЕТСКИЙ ПР.";"Университетский пр., Шахматова ул.";"59,87221169";"29,8689537";"Остановка";"356,356АШ,360"
"УНИВЕРСИТЕТСКИЙ ПР.[тест]";"УНИВЕРСИТЕТСКИЙ ПР.";"Чичеринская ул., Университетский пр.";"59,87444685";"29,8561096";"Остановка";"210,344,352,356,356Б,358,359"
"НОВОЧЕРКАССКИЙ ПР.";"НОВОЧЕРКАССКИЙ ПР.";"Красногвардейская пл., Новочеркасский пр.";"59,94262585";"30,4093781";"Остановка";"181"
"МОСКОВСКАЯ СЛАВЯНКА []<";"МОСКОВСКАЯ СЛАВЯНКА";"Колпинское ш.";"59,74854032";"30,4964714";"Остановка";"179,325,374"
"САДОВАЯ УЛ.";"САДОВАЯ УЛ.";"Садовая ул., Невский пр.";"59,93388058";"30,3343449";"Остановка";"181"
"ВОЗНЕСЕНСКИЙ ПР.";"ВОЗНЕСЕНСКИЙ ПР.";"Садовая ул., Вознесенский пр.";"59,92262741";"30,3076096";"Остановка";"181"
"ВОЗНЕСЕНСКИЙ ПР.";"ВОЗНЕСЕНСКИЙ ПР.";"Садовая ул., переулок Бойцова";"59,92303817";"30,3092823";"Остановка";"181"
"ПОЛЮСТРОВСКИЙ ПР.";"ПОЛЮСТРОВСКИЙ ПР.";"Пискаревский пр., Среднеохтинский пр.";"59,96359005";"30,4091663";"Остановка";"133,181"
"ПР. МЕТАЛЛИСТОВ, УГ.АПРЕЛЬСКОЙ УЛ.";"ПР. МЕТАЛЛИСТОВ, УГ.АПРЕЛЬСКОЙ УЛ.";"Апрельская ул., Металлистов пр.";"59,96485501";"30,4197769";"Остановка";"181,183"
"ПАРКОВАЯ УЛ., УГ. САДОВОЙ УЛ. [188]";"ПАРКОВАЯ УЛ., УГ. САДОВОЙ УЛ.";"Парковая ул., Павловское ш.";"59,71201457";"30,4096222";"Остановка";"188,378,380"
"УЛ.АПРЕЛЬСКАЯ,УГ.УЛ.М.ТУХАЧЕВСКОГО";"УЛ.АПРЕЛЬСКАЯ,УГ.УЛ.М.ТУХАЧЕВСКОГО";"Маршала Тухачевского ул., Апрельская ул.";"59,96882049";"30,4268475";"Остановка";"181,183"
""КОЛПИНО, 2-Е ОТД. К-ТА "ПОБЕДА"";""КОЛПИНО, 2-Е ОТД. К-ТА "ПОБЕДА"";"Загородная улица";"59,78123467";"30,5940018";"Остановка";"327,332,336,337,337А,387,389"
"УСТЬ-ИЖОРА, Ж.-Д. ПЕРЕЕЗД";"УСТЬ-ИЖОРА, Ж.-Д. ПЕРЕЕЗД";"ул. Загородная, ул. Колпинская";"59,78988269";"30,6010094";"Остановка";"327,332,336,337,337А"
"УСТЬ-ИЖОРА,УЛ. ТРУДА,24";"УСТЬ-ИЖОРА,УЛ. ТРУДА,24";"Загородная ул., Петрозаводское шоссе";"59,79705444";"30,6052723";"Остановка";"327,337"
"СЛАВЯНСКАЯ ДОРОГА";"СЛАВЯНСКАЯ ДОРОГА";"Петрозаводское шоссе, Социалистическая улица";"59,80315283";"30,5966187";"Остановка";"189,327,335,335А,337,337А"
"УСТЬ-ИЖОРА, ПЛАНОВАЯ УЛ.";"УСТЬ-ИЖОРА, ПЛАНОВАЯ УЛ.";"Петрозаводское шоссе, Плановая улица";"59,80881388";"30,5881252";"Остановка";"189,327,335,335А,337,337А"
"УСТЬ-ИЖОРА, ПОЛЕВАЯ УЛ.";"УСТЬ-ИЖОРА, ПОЛЕВАЯ УЛ.";"Петрозаводское шоссе, улица Некрасова";"59,81636962";"30,5739288";"Остановка";"189,327"
"ПР. ОБУХОВСКОЙ ОБОРОНЫ, ПЕРЕСЕЧКА";"ПР. ОБУХОВСКОЙ ОБОРОНЫ, ПЕРЕСЕЧКА";"проспект Обуховской обороны, Рабфаковская улица";"59,85543975";"30,4805737";"Остановка";"189,327"
"УСТЬ-ИЖОРА, ПОЛЕВАЯ УЛ.";"УСТЬ-ИЖОРА, ПОЛЕВАЯ УЛ.";"Петрозаводское шоссе, улица Некрасова";"59,81601591";"30,5745506";"Остановка";"327"
